numCinema;nomCinema;adresseCinema;proprietaireCinema;programmateurCinema;genre;multiplexe;geolocalisation;nouvelleRegion;numDepartement;numCommune
468473;LA NEF - RELAIS CULTUREL DE WISSEMBOURG;6, RUE DES ECOLES;COMMUNE DE WISSEMBOURG;;FIXE;NON;49.036084, 7.946947;Grand-Est;67;67544
468533;GERARD PHILIPE;10 B RUE DE LA 1ERE ARMEE;VILLE DE WITTENHEIM;;FIXE;NON;47.822671, 7.337178;Grand-Est;68;68376
469245;CINEMA PARADISO;2 RUE MARC SANGNIER;STUDIO 43;SARL GPCI;FIXE;NON;48.714932, 2.489765;Ile-de-France;91;91691
470161;A RUSCANA PLEIN AIR;ROUTE DE PINARELLO;PINNA JEAN DANIEL;;FIXE;NON;41.687469, 9.365073;Corse;2A;2A362
575001;MEGARAMA;44 AVENUE DE LA LONGUE BERTRANE;LES IMAGES;SAS AGORA CINEMAS;FIXE;OUI;48.930677, 2.320895;Ile-de-France;92;92078
700250;CINEMA LA PASSERELLE;CHEMIN DE LA PASSERELLE;LES PASSEURS;GROUPEMENT DES SALLES FAMILIALES DE LYON (GSF);FIXE;NON;45.94045500000001, 4.77174500000001;Auvergne - Rhône-Alpes;1;1427
703300;RELAIS CULTUREL;AVENUE VAN GOGH;SOCIETE D ECONOMIE MIXTE DES SAINTES MARIES DE LA MER;;FIXE;NON;43.450397, 4.427827;Provence-Alpes-Côte-d'Azur;13;13096
706850;TICKY HOLGADO;389 CHEMIN DE BLAZA;ASSOCIATION CINEFOL 31;;FIXE;NON;43.795535, 1.6077;Occitanie;31;31066
709650;ESPACE LUMIERE;PLACE LANGLADE;ESPACE LUMIERE BALBIGNY;SNC SAGEC - CINE 32 VEO;FIXE;NON;45.817369, 4.183976;Auvergne - Rhône-Alpes;42;42011
719456;LE MELIES;28 ALLEE HENRI FRENAY;LIGUE DE L ENSEIGNEMENT FEDERATION DEPARTEMENTALE DE L ISERE;;FIXE;NON;45.182643, 5.723905;Auvergne - Rhône-Alpes;38;38185
720700;OCINE;AVENUE DE LA GARE;LE PARIS;OCINE;FIXE;OUI;50.273088, 3.97037;Hauts-de-France;59;59392
720950;CINEVILLE;RUE MARIE CURIE;CINEVILLE;SAS CINE DIFFUSION;FIXE;OUI;47.189868, -1.4869;Pays de la Loire;44;44190
721200;CAPITOLE STUDIO;AVENUE DE SAINT TRONQUET;LE CAPITOLE;UGC MEDITERRANEE;FIXE;OUI;43.980769, 4.874683;Provence-Alpes-Côte-d'Azur;84;84092
721250;CINEMAS LIDO 1;AVENUE VICTOR HUGO;LES CINEMAS DE SAINT RAPHAEL (EX LIDO RIALTO CINEMA ST RAPHAEL);;FIXE;NON;43.42402, 6.769447;Provence-Alpes-Côte-d'Azur;83;83118
722760;PATHE;300 AVENUE DE L'UNIVERSITE;PATHE LA VALETTE;LES CINEMAS GAUMONT PATHE;FIXE;OUI;43.137099, 6.003711;Provence-Alpes-Côte-d'Azur;83;83144
723480;KINEPOLIS FENOUILLET;15 RUE DES USINES;KINEPOLIS IMMO THIONVILLE;KINEPOLIS;FIXE;OUI;43.690447, 1.403453;Occitanie;31;31182
723600;MEGARAMA;82 BOULEVARD VICTOR BORDIER;FORUM INTERNATIONAL;SAS AGORA CINEMAS;FIXE;OUI;48.994228, 2.194982;Ile-de-France;95;95424
724048;CINE LOIRE;141 RUE DU COLOMBIER;SOCIETE DES CINEMAS DE TOURS;LES CINEMAS GAUMONT PATHE;FIXE;OUI;47.416279, 0.702126;Centre - Val-de-Loire;37;37261
724120;UGC CINE CITE VELIZY;2 AVENUE DE L'EUROPE;UGC CINE CITE;UGC DIFFUSION;FIXE;OUI;48.78103, 2.189542;Ile-de-France;78;78640
724520;LE GRAND PALAIS;PLACE BESSIERES;SOCIETE CADURCIENNE D'EXPLOITATION CINEMATOGRAPHIQUE;SARL SOCIETE CADURCIENNE D'EXPLOITATION CINEMATOGRAPHIQUE;FIXE;NON;44.456197, 1.450773;Occitanie;46;46042
31;UGC NORMANDIE;116 AVENUE DES CHAMPS ELYSEES;UGC SAS;UGC DIFFUSION;FIXE;NON;48.872265, 2.300938;Ile-de-France;75;75108
321;PATHE;32 RUE LOUIS LEGRAND;GAUMONT;LES CINEMAS GAUMONT PATHE;FIXE;NON;48.870632, 2.334338;Ile-de-France;75;75102
733;STUDIO GALANDE;42 RUE GALANDE;STUDIO GALANDE BERUCHET;;FIXE;NON;48.851619, 2.347076;Ile-de-France;75;75105
802;UGC ROTONDE;103 BD DU MONTPARNASSE;UGC SAS;UGC DIFFUSION;FIXE;NON;48.842318, 2.328975;Ile-de-France;75;75106
821;PARNASSIEN;98 BD DU MONTPARNASSE;LES CINQ PARNASSIENS;;FIXE;NON;48.842443, 2.327625;Ile-de-France;75;75114
1791;LUMINOR HOTEL DE VILLE;20 RUE DU TEMPLE;CARLOTTA CINEMAS;;FIXE;NON;48.858689, 2.353591;Ile-de-France;75;75104
3741;STUDIO 28;10 RUE THOLOZE;STUDIO 28;;FIXE;NON;48.886142, 2.335342;Ile-de-France;75;75118
8291;L ARLEQUIN PANORAMA;76 RUE DE RENNES;LES ECRANS DE PARIS;;FIXE;NON;48.851278, 2.330648;Ile-de-France;75;75106
8341;NOUVEL ODEON;6 RUE DE L ECOLE DE MEDECINE;CINEDEVIL;SARL EXHANTHUS;FIXE;NON;48.850764, 2.341747;Ile-de-France;75;75106
8374;ECOLES CINEMA CLUB;23 RUE DES ECOLES;CINELUX;;FIXE;NON;48.848384, 2.348973;Ile-de-France;75;75105
8451;STUDIO DES URSULINES;10 RUE DES URSULINES;SARL DES AUTEURS REALISATEURS PRODUCTEURS ARP;;FIXE;NON;48.842733, 2.342044;Ile-de-France;75;75105
8632;UGC  GOBELINS;66 BIS AV DES GOBELINS;UGC SAS;UGC DIFFUSION;FIXE;OUI;48.832888, 2.354241;Ile-de-France;75;75113
9900;MK2 QUAI DE LOIRE;5/19 QUAI DE LA LOIRE;MK2 QUAI DE LOIRE;SA MK2 VISION;FIXE;NON;48.885067, 2.374123;Ile-de-France;75;75119
10992;PANDORA;6 ALLEE SIMONE SIGNORET;CINE ACHERES PANDORA;;FIXE;NON;48.960956, 2.067774;Ile-de-France;78;78005
11592;CGR AGEN;PLACE DU PIN;CAP CINEMA AGEN;SARL LES FILMS DE LA ROCHELLE;FIXE;OUI;44.204567, 0.624721;Nouvelle Aquitaine;47;47001
12454;CINEMA MUNICIPAL MARCEL PAGNOL;9 RUE VICTOR HUGO;GRAND ECRAN POUR TOUS;;FIXE;NON;43.566091, 4.189267;Occitanie;30;30003
12562;THEOPHILE DE VIAU;PLACE DE LA MAIRIE;CIRCUIT ARTS ET LOISIRS;SAINT LOUIS;FIXE;NON;44.299994, 0.336667;Nouvelle Aquitaine;47;47004
13423;LE MAZARIN;3TER RUE MAZARINE - 6 RUE LAROQU;CINEMAZARIN;LES CINEMAS GAUMONT PATHE;FIXE;NON;43.526103, 5.448686;Provence-Alpes-Côte-d'Azur;13;13001
13686;L ELLIPSE;BD LOUIS CAMPI;MSGCINEMA;;FIXE;NON;41.943558, 8.753935;Corse;2A;2A004
14114;Cinéma SNA;P. DE L'AMITIE ENTRE LES PEUPLES;ASSOCIATION DE GESTION DE LA SCENE NATIONALE D'ALBI;SNC SAGEC - CINE 32 VEO;FIXE;NON;43.923796, 2.144604;Occitanie;81;81004
14445;PLANET'CINE;194 RUE DE BRETAGNE;LES ECRANS D' ALENCON;SAS CINE DIFFUSION;FIXE;NON;48.433552, 0.063775;Normandie;61;61001
14693;LE POLE CULTUREL;82 RUE MARCEL BOURDARIAS;L'AVANT-SCENE;;FIXE;NON;48.807586, 2.422346;Ile-de-France;94;94002
17082;CASINO MUNICIPAL;4 AVENUE DU DOCTEUR BOUIX;SA CASINO D'AMELIE LES BAINS;CINEMAGINAIRE;FIXE;NON;42.472951, 2.670403;Occitanie;66;66003
17303;STUDIO ORSON WELLES;2 PLACE LEON GONTIER;MAISON DE LA CULTURE D AMIENS;;FIXE;NON;49.89407, 2.292451;Hauts-de-France;80;80021
17326;GAUMONT;5 BOULEVARD DE BELFORT;GAUMONT PICARDIE;LES CINEMAS GAUMONT PATHE;FIXE;OUI;49.889445, 2.304933;Hauts-de-France;80;80021
18701;Normandie;6 RUE DESIRE ROUSSEL;COMMUNE D'ANET;;FIXE;NON;48.857505, 1.439036;Centre - Val-de-Loire;28;28007
19941;NEMOURS;22 RUE STE CLAIRE;ROUEX;LES CINEMAS GAUMONT PATHE;FIXE;NON;45.898226, 6.123792;Auvergne - Rhône-Alpes;74;74010
19945;CINEMA MJC NOVEL;PLACE ANNAPURNA;MJC POUR TOUS D'ANNECY NOVEL;;FIXE;NON;45.917017, 6.134075;Auvergne - Rhône-Alpes;74;74010
19984;SALEVE;LE CLOS FLEURY;CINEMONDE;;FIXE;NON;46.192243, 6.232615;Auvergne - Rhône-Alpes;74;74012
21571;LE CHOUCA;LA FRASSE;BAUCINE;;FIXE;NON;46.042963, 6.631059;Auvergne - Rhône-Alpes;74;74014
23262;LE TURENNE;AVENUE  POINCARE;CENTRE REGIONAL PROMOTION IMAGE LE SENECHAL;SNC SAGEC - CINE 32 VEO;FIXE;NON;45.091845, 1.943901;Nouvelle Aquitaine;19;19010
23491;LE COMMYNES;RUE DE LA FRERIE;ASSOCIATION SAINTE CECILE;;FIXE;NON;46.983737, -0.446514;Nouvelle Aquitaine;79;79013
24753;STARS;13 AV DU GENERAL DE GAULLE;CINAEA;;FIXE;NON;48.590692, 2.250123;Ile-de-France;91;91021
25032;MEGARAMA ARRAS;48 GRAND' PLACE;LECA;SAS AGORA CINEMAS;FIXE;NON;50.29185, 2.780997;Hauts-de-France;62;62041
28113;PAUL GRIMAULT;1 AV DE LA DIVISION LECLERC;SCENE ET ECRAN;SARL GPCI;FIXE;NON;48.9589, 1.855229;Ile-de-France;78;78029
28264;STUDIO;2 RUE EDOUARD POISSON;ASSOCIATION CINEMA LE STUDIO;SARL GPCI;FIXE;NON;48.910534, 2.384966;Ile-de-France;93;93001
28661;LE CARFOUR;ROUTE DE NESMY;ASSOCIATION JEUNESSE LOISIRS ET AVENIR;SUD CINE;FIXE;NON;46.623209, -1.427738;Pays de la Loire;85;85008
28732;ATOMIC;23 RUE DU PRIEURE;ATOMIC CINEMA;SARL GPCI;FIXE;NON;47.488316, 2.43949;Centre - Val-de-Loire;18;18015
28991;COLBERT;GRANDE RUE;ASSOCIATION CINEMA LE COLBERT;SNC SAGEC - CINE 32 VEO;FIXE;NON;45.956961, 2.170097;Nouvelle Aquitaine;23;23008
29373;CINE GOYEN;13 RUE LOUIS PASTEUR;VIGOUROUX YVES;SARL MICROMEGAS DIFFUSION CINEMATOGRAPHIQUE;FIXE;NON;48.022078, -4.5389;Bretagne;29;29003
29741;SALLE POLYVALENTE;SALLE POLYVALENTE;CINE PARC;SNC SAGEC - CINE 32 VEO;ITINERANT;NON;45.71712, 3.633074;Auvergne - Rhône-Alpes;63;63016
33751;VOX;22 PLACE DE L HORLOGE;CINEVOX;SARL GPCI;FIXE;NON;43.949433, 4.806281;Provence-Alpes-Côte-d'Azur;84;84007
36602;LE SCENARIO;RUE DU CHENE VERT;CINE SPECTACLES DE BAIN DE BRETAGNE;SAS CINE DIFFUSION;FIXE;NON;47.845691, -1.687075;Bretagne;35;35012
38592;SALLE COMMUNALE;SALLE COMMUNALE;ASSOCIATION PROMOTION ACTIVITE CULTURELLE AUDIOVISUELLE MARMANDE;SNC SAGEC - CINE 32 VEO;ITINERANT;NON;44.169886, 0.285632;Nouvelle Aquitaine;47;47021
38931;L UBAYE;19 RUE HENRI MERCIER;CINE ESPACE EVASION;;FIXE;NON;44.387012, 6.653653;Provence-Alpes-Côte-d'Azur;4;4019
42011;STELLA CINE;9 RUE DU PRESBYTERE;ASSOCIATION SAINT LAURENT;;FIXE;NON;47.542333, -0.107495;Pays de la Loire;49;49018
42075;GULF STREAM;52 AV DU GENERAL DE GAULLE;SAEM LOCALE GULF STREAM;;FIXE;NON;47.283747, -2.391924;Pays de la Loire;44;44055
45876;AGNES VARDA;8 AV DE BOURGOGNE;ASSOCIATION CULTURELLE ARGENTINE;;FIXE;NON;49.437982, 2.099627;Hauts-de-France;60;60057
45877;CGR BEAUVAIS;16 RUE CORRÉUS;BEAUVAIS CINEMA COMMUNICATION;SARL LES FILMS DE LA ROCHELLE;FIXE;OUI;49.426913, 2.091861;Hauts-de-France;60;60057
46862;LE FESTIVAL;151 BD ALBERT 1ER;FLIP BOOK;;FIXE;NON;44.813225, -0.563936;Nouvelle Aquitaine;33;33039
49522;REX;6, RUE CLEMENCEAU;COMMUNAUTE DE COMMUNES BENFELD ET ENVIRONS;;FIXE;NON;48.369448, 7.595426;Grand-Est;67;67028
50033;CINOS;442, RUE DE L'IMPÉRATRICE;CINOS;;FIXE;NON;50.408345, 1.593105;Hauts-de-France;62;62108
50833;REX;33 RUE LOBROT;SOCIETE NORMANDE D EXPLOITATION INDUSTRIELLE ET COMMERCIALE;SARL GPCI;FIXE;NON;49.090933, 0.602729;Normandie;27;27056
53122;ETOILE BETHUNE;379, avenue de Lens;ETOILE CINEMAS DEVELOPPEMENT;;FIXE;OUI;50.521692, 2.641202;Hauts-de-France;62;62119
58735;LES LOBIS;12 AVENUE MAUNOURY;CINECAP;CAP'CINEMA;FIXE;NON;47.590803, 1.335364;Centre - Val-de-Loire;41;41018
58773;CAP' CINE;RUE DES ONZE ARPENTS;CINECAP;CAP'CINEMA;FIXE;OUI;47.612706, 1.336917;Centre - Val-de-Loire;41;41018
59033;AUDITORIUM BOURSE TRAVAIL;11 RUE DU 8 MAI 1945;EST ENSEMBLE;;ITINERANT;NON;48.90951, 2.436542;Ile-de-France;93;93008
61132;LE CLAP;PLACE DE LA MAIRIE;ASSOCIATION CINEBOL;SARL MC4 DISTRIBUTION;FIXE;NON;43.974273, 7.312365;Provence-Alpes-Côte-d'Azur;84;84019
67734;FOYER;PLACE DES NOYERS;ASSOCIATION DU CINEMA LE FOYER;SNC SAGEC - CINE 32 VEO;FIXE;NON;45.295097, 4.558306;Auvergne - Rhône-Alpes;42;42023
68212;AUDITORIUM DU CONSERVATOIRE;11 BD CARNOT;LES GEMEAUX SCENE NATIONALE;;FIXE;NON;48.778884, 2.317531;Ile-de-France;92;92014
68561;FAMILIA;MAIL ORYE;AMICALE DES ANCIENS ELEVES ECOLE LAIQUE;SOGECI;FIXE;NON;47.28271, 0.171969;Centre - Val-de-Loire;37;37031
68562;ABBAYE DE BOURGUEIL;AVENUE ARTHUR-LE-JOUTEUX;ASSOCIATION DE L'ABBAYE DE BOURGUEIL;;FIXE;NON;47.281285, 0.171088;Centre - Val-de-Loire;37;37031
71942;LA BOBINE;30 RUE DE LA PETITE MOTTE;LE CINEMA LA BOBINE;SAS CINE DIFFUSION;FIXE;NON;48.0505921, -1.8653428000000076;Bretagne;35;35037
73099;LES STUDIOS;136 RUE JEAN JAURES;LES FEUX DE LA RAMPE;SAS CINE DIFFUSION;FIXE;NON;48.396163, -4.477034;Bretagne;29;29019
73371;LE FIEF;RUE DU FIEF;ASSOCIATION CINEMA LE FIEF CAFE;SUD CINE;FIXE;NON;46.629207, -1.852443;Pays de la Loire;85;85035
73582;NORMANDY;PLACE DE LA MAIRIE;LIGUE DE L' ENSEIGNEMENT DE BASSE-NORMANDIE;GENERIQUE;FIXE;NON;49.044986, -0.326254;Normandie;14;14100
77351;PATHE;6 RUE DES FRERES LUMIERE;PATHE BRUMATH;LES CINEMAS GAUMONT PATHE;FIXE;OUI;48.744007, 7.692978;Grand-Est;67;67067
77733;CINEVILLE;15 AVENUE DE CEZAMBRE;CINEVILLE;SAS CINE DIFFUSION;FIXE;NON;48.02898, -1.75349;Bretagne;35;35047
78505;reg'Art;PLACE DU 19 MARS 1962;REGAIN;SARL MC4 DISTRIBUTION;FIXE;NON;44.275689, 5.27174;Auvergne - Rhône-Alpes;26;26063
80391;MEGA CGR;AVENUE DES FRERES LUMIERE;BUXEMOND;SARL LES FILMS DE LA ROCHELLE;FIXE;OUI;46.610272, 0.367025;Nouvelle Aquitaine;86;86041
81311;SALLE LUX;PLACE DU CHATEAU;LE PARADIS;SNC SAGEC - CINE 32 VEO;FIXE;NON;44.636357, -0.320145;Nouvelle Aquitaine;33;33081
81414;SALLE PIERRE DAURE;UNIVERSITE DE CAEN;AEP CINEMA LUX;;FIXE;NON;49.17442, -0.333727;Normandie;14;14118
81541;ESPACE  CENTRE;5 AV DE VERDUN;CAGNES CONGRES;;FIXE;NON;43.662147, 7.148711;Provence-Alpes-Côte-d'Azur;6;6027
81545;CGR POLYGONE RIVIERA;AVENUE DES ALPES;CAP CINEMA CAGNES SUR MER;SARL LES FILMS DE LA ROCHELLE;FIXE;OUI;43.661565, 7.1357;Provence-Alpes-Côte-d'Azur;6;6027
82392;CINEMA D ARGOAT;4 RUE DU CLEUMEUR;ASSOCIATION LA BELLE EQUIPE;SARL MICROMEGAS DIFFUSION CINEMATOGRAPHIQUE;FIXE;NON;48.404288, -3.427185;Bretagne;22;22025
82603;SALLE MELIES;67 CHEMIN DE VASSIEUX;CALUIRE PAROISSES;GROUPEMENT DES SALLES FAMILIALES DE LYON (GSF);FIXE;NON;45.797955, 4.866922;Auvergne - Rhône-Alpes;69;69034
83071;LE PALACE;17 RUE ML DE LATTRE DE TASSIGNY;LE PALACE;UGC DIFFUSION;FIXE;NON;50.174792, 3.236568;Hauts-de-France;59;59122
84734;STUDIO 13;23 AV DU DOCTEUR PICAUD;MJC DE CANNES PICAUD;;FIXE;NON;43.550716, 7.001343;Provence-Alpes-Côte-d'Azur;6;6029
84774;PROSPER MERIMEE;25 AVENUE FRANCIS TOMER;CANNES CINEMA;;FIXE;NON;43.54938, 6.981931;Provence-Alpes-Côte-d'Azur;6;6029
84781;MIRAMAR;RUE PASTEUR - ANGLE CROISETTE;CANNES CINEMA;;FIXE;NON;43.550134, 7.029043;Provence-Alpes-Côte-d'Azur;6;6029
84782;ALEXANDRE III;19 BD ALEXANDRE III;CANNES CINEMA;;FIXE;NON;43.546541, 7.036474;Provence-Alpes-Côte-d'Azur;6;6029
86103;CGR CARCASSONNE;ZONE DU PONT ROUGE;CAP  CINEMA  CARCASSONNE;SARL LES FILMS DE LA ROCHELLE;FIXE;OUI;43.235546, 2.367714;Occitanie;11;11069
86353;LE GRAND BLEU;CENTRE CULTUREL;ASSOCIATION CONTRECHAMP;SAS CINE DIFFUSION;FIXE;NON;48.283143, -3.572343;Bretagne;29;29024
86860;SALLE MULTISERVICE;1 ROUTE DEPARTEMENTALE 42;ASSOCIATION BEARN ADOUR TOURISME ET LOISIRS;SAINT LOUIS;ITINERANT;NON;43.4817151, -0.2803853000000345;Nouvelle Aquitaine;64;64167
88111;LE MELIES;LE BEZINAT;ASSOCIATION CINEFOL 31;SNC SAGEC - CINE 32 VEO;FIXE;NON;43.680383, 1.534648;Occitanie;31;31117
89105;CGR CASTRES;24 QUAI MIREDAMES;SOCIETE D'EXPLOITATION CINEMATOGRAPHIQUE;SARL LES FILMS DE LA ROCHELLE;FIXE;NON;43.606683, 2.243043;Occitanie;81;81065
90191;CASINO;ESPLANADE DES OEUFS;SOCIETE D' EXPLOITATION DES CASINOS PYREEENS;;FIXE;NON;42.88755, -0.114879;Occitanie;65;65138
91492;CINEMA DU THEATRE;8 AVENUE CHARLES DE GAULLE;VILLE DE LA CELLE SAINT CLOUD;;FIXE;NON;48.847416, 2.136047;Ile-de-France;78;78126
92441;7EME ART;PLACE DE LA MAIRIE;ASSOCIATION CINEMA DU BOCAGE;SUD CINE;FIXE;NON;46.821515, -0.668137;Nouvelle Aquitaine;79;79062
94743;CLUB;1 RUE MONTORCY;SECIM;SNC SAGEC - CINE 32 VEO;FIXE;NON;46.848712, -1.879118;Pays de la Loire;85;85047
95044;AXEL;69 RUE GLORIETTE;CINEMA RITZ SARL;SAS AGORA CINEMAS;FIXE;NON;46.781288, 4.850256;Bourgogne - Franche-Comté;71;71076
95076;MEGARAMA;1 RUE RENE CASSIN;CINEMA RITZ SARL;SAS AGORA CINEMAS;FIXE;OUI;46.775786, 4.864432;Bourgogne - Franche-Comté;71;71076
96184;VOX;22 COURS DU BARTAVEL;CHAMONIX SPECTACLES;;FIXE;NON;45.923063, 6.86902;Auvergne - Rhône-Alpes;74;74056
96641;RHODO;LE CENTRE;SOCIETE DES CINEMAS DE COURCHEVEL;SARL MC4 DISTRIBUTION;FIXE;NON;45.454122, 6.692461;Auvergne - Rhône-Alpes;73;73071
99031;ELYSEE;25, AVENUE DU MARECHAL JOFFRE;CINE FRERES;;FIXE;NON;49.191375, 2.464237;Hauts-de-France;60;60141
103201;CINE ESPERANCE;3 RUE DE LA CONTERIE;FEDERATION ESPERANCE CHARTRES DE BRETAGNE;SAS CINE DIFFUSION;FIXE;NON;48.040732, -1.692346;Bretagne;35;35066
103561;VOX;PLACE DE L EGLISE;RENON IRENE EPOUSE VERGNAUD;SNC SAGEC - CINE 32 VEO;FIXE;NON;45.823984, 0.44846;Nouvelle Aquitaine;16;16085
104164;ES RECOLLETS;RUE DU THEATRE;CINE-OFF;;FIXE;NON;47.696864, 0.415325;Pays de la Loire;72;72071
104181;LE DUNOIS;17 RUE DE VARIZE;BENTABET HOCINE;;FIXE;NON;48.071336, 1.331864;Centre - Val-de-Loire;28;28088
104642;COLISEE;1 PLACE DU COLISEE;COMMUNAUTE DE COMMUNES BRIANCE-COMBADE;SNC SAGEC - CINE 32 VEO;FIXE;NON;45.714496, 1.608216;Nouvelle Aquitaine;87;87040
104661;ESPACE MARCEL PAGNOL;RUE ERASME GUICHET;OFFICE MUNICIPAL DE LA CULTURE DE CHATEAUNEUF;;FIXE;NON;43.383798, 5.16491;Provence-Alpes-Côte-d'Azur;13;13026
104851;LE BALZAC;16 PLACE ARISTIDE BRIAND;ASSOCIATION CENTRE CULTUREL DE CHATEAU RENAULT;;FIXE;NON;47.592055, 0.915712;Centre - Val-de-Loire;37;37063
105375;LES 400 COUPS;4 RUE AIME RASSETEAU;MJC LES 400 COUPS;SNC SAGEC - CINE 32 VEO;FIXE;NON;46.810802, 0.542436;Nouvelle Aquitaine;86;86066
106181;SELECT;46 RUE DU MARECHAL;ALLIANCE BOURGUIGNONNE CINEMATOGRAPHIQUE;;FIXE;NON;47.858822, 4.57312;Bourgogne - Franche-Comté;21;21154
107043;A L'AFFICHE;7 PLACE EMILE GOGUENHEIM;LES ECRANS DE CHAUMONT;SARL NORD OUEST EXPLOITATION CINEMA;FIXE;OUI;48.110117, 5.13491;Grand-Est;52;52121
108192;ATRIUM;3 PARVIS ROBERT SCHUMAN;REGIE CULTURELLE ATRIUM DE CHAVILLE;SARL GPCI;FIXE;NON;48.813094, 2.192579;Ile-de-France;92;92022
108932;CLUB;RUE DES VENELLES;ABC49 LES AMIS DU BON CINEMA;;FIXE;NON;47.212271, -0.72686;Pays de la Loire;49;49092
109792;CGR ODEON;51 RUE DU MARECHAL FOCH;SOCIETE RENNAISE DE DIFFUSION CINEMATOGRAPHIQUE;SARL LES FILMS DE LA ROCHELLE;FIXE;NON;49.638968, -1.621407;Normandie;50;50129
113131;LE CINE-MALICE;7 RUE LOUIS XIII;TEXIER PASCAL;SUD CINE;FIXE;NON;46.148022, 0.295463;Nouvelle Aquitaine;86;86078
114032;ESPACE PHILIPPE NOIRET;PLACE CHARLES DE GAULLE;COMMUNE DE CLAYES SOUS BOIS;;FIXE;NON;48.821274, 1.987156;Ile-de-France;78;78165
118135;FRANCOIS TRUFFAUT;7 RUE CARCANO;ASSOCIATION OFFICE MUNICIPAL D'ANIMATION;;FIXE;NON;48.763489, 5.589497;Grand-Est;55;55122
119122;CINEMA MUNICIPAL;CINEMA MUNICIPAL;LIGUE DE L' ENSEIGNEMENT DE BASSE-NORMANDIE;GENERIQUE;ITINERANT;NON;49.06477, -1.036857;Normandie;50;50139
119281;JEAN VILAR;1 RUE DES DOCTEURS GRANDJEAN;CENTRE CULTUREL JEAN VILAR - CINEMA LUX;;FIXE;NON;49.168276, 5.857616;Grand-Est;54;54136
125322;LE TRAVELLING;RUE ARISTIDE BRIAND;ASSOCIATION CULTURE ET RENCONTRES;SONHIR;FIXE;NON;50.453829, 2.940575;Hauts-de-France;62;62250
126311;LE LONG-COURT;5 RUE PAUL MAUNDRELL;SOCIETE DU CINEMA MAJESTIC;;FIXE;NON;49.050552, -1.444356;Normandie;50;50147
127501;HENRI GEORGES CLOUZOT;RUE DU CHAMPS DE FOIRE;COMMUNE DE LA CRECHE;SNC SAGEC - CINE 32 VEO;FIXE;NON;46.362399, -0.298072;Nouvelle Aquitaine;79;79048
127661;LA FAIENCERIE;ALLEE NELSON;OFFICE MUNICIPAL CULTUREL DE CREIL;;FIXE;NON;49.259398, 2.472183;Hauts-de-France;60;60175
131031;LE CIGALON;COURS DE POURRIERES;ASSOCIATION CULTURE ET LOISIRS EDEN CINEMA;PROVENCAUX ASSOCIES;FIXE;NON;43.774382, 5.440971;Provence-Alpes-Côte-d'Azur;84;84042
133141;LES CARDINAUX;AVENUE PRAT GODET;CINE DAMGAN;SARL MICROMEGAS DIFFUSION CINEMATOGRAPHIQUE;FIXE;NON;47.520393, -2.585183;Bretagne;56;56052
133621;LE FOYER;RUE ALFRED DORNIER;ASSOCIATION  DES FAMILLES DU  CANTON DE DAMPIERRE SUR SALON;;FIXE;NON;47.553711, 5.676507;Bourgogne - Franche-Comté;70;70198
136666;LE GRAND CLUB;11 AVENUE DU SABLAR;LE CLUB;SAR LE CLUB (Pfister);FIXE;NON;43.714843, -1.055363;Nouvelle Aquitaine;40;40088
137663;CINE DESVRES;8, RUE VICTOR LENGAGNE;OFFICE DU TOURISME ET DE LA CULTURE DE DESVRES;ENT. REG. CIN. NORD PAS DE CALAIS;FIXE;NON;50.668276, 1.837675;Hauts-de-France;62;62268
138352;CINEMAS GRAND FORUM;ESPLANADE ROSA LEROY;CINE DIEPPE;;FIXE;OUI;49.921565, 1.079726;Normandie;76;76217
138641;MAJESTIC;24 RUE NATIONALE;ENGELS WILLIAM;;FIXE;NON;46.480212, 3.977127;Bourgogne - Franche-Comté;71;71176
138712;OLYMPIA;16 AV DU MARECHAL FOCH;GAUMONT;LES CINEMAS GAUMONT PATHE;FIXE;OUI;47.323594, 5.030088;Bourgogne - Franche-Comté;21;21231
138922;2 ALIZES SALLE LA MOUETTE;2 BD ALBERT 1ER;EMERAUDE CINEMAS;SAS CINE DIFFUSION;FIXE;NON;48.635211, -2.055645;Bretagne;35;35093
139503;CINE DOL;RUE DU LEGEARD;CINE DOL;SARL MICROMEGAS DIFFUSION CINEMATOGRAPHIQUE;FIXE;NON;48.546939, -1.753756;Bretagne;35;35095
144303;CINEMA DE GOURETTE;GOURETTE;ASSOCIATION GESTION LOCAUX SOCIAUX;;FIXE;NON;42.958713, -0.332293;Nouvelle Aquitaine;64;64204
144331;FOYER ARMAGNAC EAUZE;16 PLACE DE LA LIBERTE;OFFICE DU TOURISME D'EAUZE;SNC SAGEC - CINE 32 VEO;FIXE;NON;43.859667, 0.100888;Occitanie;32;32119
145792;ECULLY CINEMA;21, AV EDOUARD AYNARD;VILLE D'ECULLY;;FIXE;NON;45.779053, 4.778383;Auvergne - Rhône-Alpes;69;69081
146013;L ESPLANADE;ESPLANADE CHARLES SPINASSE;CENTRE CULTUREL ET SPORTIF EGLETONNAIS;SNC SAGEC - CINE 32 VEO;FIXE;NON;45.404676, 2.044182;Nouvelle Aquitaine;19;19073
146762;LE ROC;BOULEVARD PASTEUR;CINEMAS G LAMIC;SARL MC4 DISTRIBUTION;FIXE;NON;44.564376, 6.493852;Provence-Alpes-Côte-d'Azur;5;5046
147071;FRANCAIS;38 RUE DU GENERAL DE GAULLE;UGC SAS;UGC DIFFUSION;FIXE;NON;48.970841, 2.307185;Ile-de-France;95;95210
147971;PALACE;33 BOULEVARD DE LA MOTTE;CINEMA PALACE;BROUILLER - SNES;FIXE;NON;49.04567, 3.958674;Grand-Est;51;51230
148324;MEGA CGR;5 AVENUE DU MARECHAL  JOFFRE;VILLERAY;SARL LES FILMS DE LA ROCHELLE;FIXE;OUI;48.957859, 2.301996;Ile-de-France;93;93031
149335;PIERRE FRESNAY;3 RUE SAINT FLAIVE;COMMUNE DE ERMONT;;FIXE;NON;48.988575, 2.259906;Ile-de-France;95;95219
149552;ARMOR CINE;RUE DU CHEMIN VERT;ASSOCIATION CATHOLIQUE DES CHEFS DE FAMILLE D ERQUY;SAS CINE DIFFUSION;FIXE;NON;48.63121, -2.463964;Bretagne;22;22054
152884;CINETAMPES;PLACE GEOFFROY ST HILAIRE;ASSOCIATION ETAMPOISE CINE PETIT THEATRE;;FIXE;NON;48.434287, 2.157598;Ile-de-France;91;91223
155143;CINEMA MUNICIPAL;CINEMA MUNICIPAL;CINEM AUDE 2000 VILLATGE AL PAIS;;ITINERANT;NON;43.158478, 2.727734;Occitanie;11;11140
157971;VOLTAIRE;LA POTERIE;CINEMAS VOLTAIRE;;FIXE;NON;46.253781, 6.118753;Auvergne - Rhône-Alpes;1;1160
158701;LE PALACE;23 RUE DENFERT ROCHEREAU;ASSOCIATION LOISIRS ET CULTURE;;FIXE;NON;48.187045, 0.653774;Pays de la Loire;72;72132
162501;SALLE DES FETES;FONCINE LE HAUT;ASSOCIATION COMITE DES FETES CINEMA;;FIXE;NON;46.656698, 6.0275;Bourgogne - Franche-Comté;39;39228
162853;CINEPARADIS;10 AVENUE MARECHAL DE VILLARS;L ERMITAGE;CINEPARADIS;FIXE;NON;48.400175, 2.71613;Ile-de-France;77;77186
163962;LE SCARRON;8 AV. JEANNE ET MAURICE DOLIVET;COMITE MUNICIPAL DES FETES;;FIXE;NON;48.791543, 2.289748;Ile-de-France;92;92032
164771;EDEN;GRAND RUE;COMMUNE DE FONTVIEILLE;;FIXE;NON;43.726491, 4.708604;Provence-Alpes-Côte-d'Azur;13;13038
166051;CINEMA DE L YSIEUX;PLACE JEAN MOULIN;COMMUNAUTE D AGGLOMERATION ROISSY PAYS DE FRANCE;;FIXE;NON;49.099464, 2.524882;Ile-de-France;95;95250
168953;CINEMA DU PIN DE LA LEGUE PLEIN AIR;2700 ROUTE DEPARTEMENTALE 4;FORUM DES ARTS;SARL MC4 DISTRIBUTION;FIXE;NON;43.3974611, 6.718800399999964;Provence-Alpes-Côte-d'Azur;83;83061
174813;ESPACE ALBERT GIRALDI;AVENUE CESAR BALDACCINI;CINEODE;SARL CINEODE;FIXE;NON;43.287544, 5.6229;Provence-Alpes-Côte-d'Azur;13;13042
175924;CINEMA MCL SLE ANDRE BOURVIL;1 BD DE ST DIE;MAISON DE LA CULTURE ET DES LOISIRS DE GERARDMER;;FIXE;NON;48.071742, 6.881569;Grand-Est;88;88196
177140;LE LAUSSY;15 RUE VICTOR HUGO;COMMUNE DE GIERES;;FIXE;NON;45.1800066, 5.791162699999973;Auvergne - Rhône-Alpes;38;38179
177201;LE CENTRAL;SQUARE DE LA MAIRIE;LES VRAIS INSTANTS DE L  IMAGE;UGC DIFFUSION;FIXE;NON;48.701701, 2.13387;Ile-de-France;91;91272
181422;LES ECRANS;6 BIS PLACE NATIONALE;ASSOCIATION LES ECRANS;;FIXE;NON;49.482406, 1.723715;Normandie;76;76312
182461;LES RHODOS;ESPACE GRAND BORNAND;MC4  DISTRIBUTION;SARL MC4 DISTRIBUTION;FIXE;NON;45.935346, 6.473902;Auvergne - Rhône-Alpes;74;74136
183942;ESPACE ROBERT HOSSEIN;BOULEVARD VICTOR JAUFFRET;REGIE CULTURELLE OUEST PROVENCE;;FIXE;NON;43.608373, 5.064398;Provence-Alpes-Côte-d'Azur;13;13044
185173;CINEMA FREDERIC MISTRAL;AVENUE PIERRE BROSSOLETTE;ECOCINE VERDON;;FIXE;NON;43.757246, 5.886021;Provence-Alpes-Côte-d'Azur;4;4094
185175;CIRCUIT VERDON SECRET;AVENUE PIERRE BROSSOLETTE;ECOCINE VERDON;;ITINERANT;NON;43.757189, 5.886009;Provence-Alpes-Côte-d'Azur;4;4094
185241;LE SCIALET;LES DOLOMITES;VILLE DE GRESSE EN VERCORS;;FIXE;NON;44.900658, 5.555056;Auvergne - Rhône-Alpes;38;38186
187852;LE DANTON;10 RUE DANTON;SARL LE DANTON;;FIXE;NON;46.600458, 4.067349;Bourgogne - Franche-Comté;71;71230
188041;LE BRETAGNE;PEGUIN;CINEMA LE BRETAGNE;SAS CINE DIFFUSION;FIXE;NON;47.990181, -1.796621;Bretagne;35;35126
188933;GERARD PHILIPE;PLACE DU MARCHE   LA HUME;ARTS ET TECHNIQUES;ARTEC;FIXE;NON;44.638602, -1.111896;Nouvelle Aquitaine;33;33199
189741;MEGAREX;5 RUE GEORGES MELIES;SOCIETE DU CINEMA MEGAREX;SA CINEMA MEGAREX (Wernet);FIXE;OUI;48.80003, 7.834416;Grand-Est;67;67180
193185;LE STUDIO;3 RUE DU GENERAL SARRAIL;LES FILMS SEINE OCEAN;;FIXE;NON;49.492799, 0.120219;Normandie;76;76351
193731;ARC EN CIEL;9 RUE FERDINAND PIHEN;OCINE;SARL GPCI;FIXE;NON;50.724833, 2.533715;Hauts-de-France;59;59295
194671;CINEVILLE;AVENUE DU BORD DES EAUX;GAUMONT;SAS CINE DIFFUSION;FIXE;OUI;50.409044, 2.9707;Hauts-de-France;62;62427
198581;CASINO;41 RUE HENRI DOBERT;SARL REGENT CINEMA;SARL NORD OUEST EXPLOITATION CINEMA;FIXE;NON;49.304867, -0.074371;Normandie;14;14338
201041;CINEMA ST CHARLES;RUE DU PONT;CINEMA SAINT CHARLES;;FIXE;NON;47.403746, -0.921463;Pays de la Loire;49;49160
202162;ELYSEE;BOULEVARD ROOSEVELT;ETABLISSEMENT PUBLIC DE COOPERATION CULTURELLE D'ISSOUDUN;;FIXE;NON;46.949327, 1.995229;Centre - Val-de-Loire;36;36088
202292;LE COLUCHE;ALLEES JEAN JAURES;REGIE CULTURELLE OUEST PROVENCE;;FIXE;NON;43.514195, 4.987268;Provence-Alpes-Côte-d'Azur;13;13047
202370;0SALLE GEORGES BRASSENS;SALLE GEORGES BRASSENS;CINESSONNE;;ITINERANT;NON;48.515193, 2.341767;Ile-de-France;91;91315
203343;SALLE DES ORMEAUX;RUE DES ECHOLERES;ASSOCIATION CINEMA DU BOCAGE;SUD CINE;FIXE;NON;46.414996, -1.574373;Pays de la Loire;85;85114
203672;SALLE SAINT MICHEL;RUE LOUIS TOUCHET;FAMILLES RURALES FEDERATION REGIONALE DES PAYS DE LA LOIRE;;FIXE;NON;47.5524248, -0.23296830000003865;Pays de la Loire;49;49163
204451;CASINO;8 RUE DE FRANCHEPRE;MAISON DES JEUNES ET DE LA CULTURE DE JOEUF;;FIXE;NON;49.229366, 6.019184;Grand-Est;54;54280
204507;Agnès Varda;Place Cassini;CINEODE;SARL CINEODE;FIXE;NON;47.983463, 3.395496;Bourgogne - Franche-Comté;89;89206
204891;FAMILIA;RUE SADI CARNOT;MARTEAU FLORENCE;SNC SAGEC - CINE 32 VEO;FIXE;NON;45.445545, -0.433778;Nouvelle Aquitaine;17;17197
205601;CENTRE CULTUREL;96 AVENUE DES BRUZACQUES;VILLE DE JOUY LE MOUTIER;;FIXE;NON;49.011314, 2.043572;Ile-de-France;95;95323
206924;CINEMA AGNES VARDA;37-39 GRANDE RUE;LE CENTRE CULTUREL DES PORTES DE L' ESSONNE;;FIXE;NON;48.688996, 2.376314;Ile-de-France;91;91326
