numCinema;nomCinema;adresseCinema;proprietaireCinema;programmateurCinema;genre;multiplexe;geolocalisation;nouvelleRegion;numDepartement;numCommune
165383;ESPACE JEAN BAUCHET;RUE FRANCIS FER;ASSOCIATION FORGES LES EAUX DEVELOPPEMENT;SARL NORD OUEST EXPLOITATION CINEMA;FIXE;NON;49.615296, 1.54519;Normandie;76;76276
165801;VOX;111,  AVENUE DE LA PLAGE;OFFICE DU TOURISME DE FORT MAHON PLAGE;SARL CINEODE;FIXE;NON;50.339949, 1.569107;Hauts-de-France;80;80333
165884;ODYSSEE;QUARTIER DU MAZETAVENUE RENE CASSIN;CENTRE CULTUREL MARCEL PAGNOL (EX COMITE MUNI ACTION SOC CULTUR);;FIXE;NON;43.453954, 4.943629;Provence-Alpes-Côte-d'Azur;13;13039
166434;LE CLUB;FORUM DE LA GARE;ASSOCIATION D'EDUCATION POPULAIRE ET CULTURELLE DU PAYS FOUGERES;SAS CINE DIFFUSION;FIXE;NON;48.348029, -1.19278;Bretagne;35;35115
166862;CASINO;PLACE BUGEAU;SOCIETE D EXPLOITATION DU CASINO DE FOURAS;SNC SAGEC - CINE 32 VEO;FIXE;NON;45.990004, -1.097971;Nouvelle Aquitaine;17;17168
167151;L EMBELLIE;46 AVENUE LA LIBERTE;COMMUNAUTE DE COMMUNES HAUTE MAURIENNE VANOISE;SARL MC4 DISTRIBUTION;FIXE;NON;45.191425, 6.648346;Auvergne - Rhône-Alpes;73;73117
168193;CINE HENRI LANGLOIS;32 BIS RUE DE LA STATION;ASSOCIATION CINE HENRI LANGLOIS;SARL GPCI;FIXE;NON;48.988437, 2.232576;Ile-de-France;95;95252
171253;CINE FRONTON;36 RUE ALAIN DE FELGUIERES;ASSOCIATION CINEFOL 31;SNC SAGEC - CINE 32 VEO;FIXE;NON;43.839626, 1.390132;Occitanie;31;31202
172213;GRAND FORUM GAILLON;AVENUE JEAN JAURES;LES ECRANS GAILLONNAIS;;FIXE;NON;49.15552, 1.344766;Normandie;27;27275
173991;LA COUPOLE;QUARTIER SAINTE APPOLONIE;TOURNEE FAMILIA;SARL MC4 DISTRIBUTION;FIXE;NON;43.721609, 7.149739;Provence-Alpes-Côte-d'Azur;6;6065
178231;JOUR DE FETE;74 RUE DE VIENNE;VILLE DE GISORS;;FIXE;NON;49.279682, 1.774186;Normandie;27;27284
182462;LE CHARMIEUX;LE CHINAILLON;MC4  DISTRIBUTION;SARL MC4 DISTRIBUTION;FIXE;NON;45.969321, 6.446761;Auvergne - Rhône-Alpes;74;74136
183951;SELECT;7 BD D HAUTESERVE;LE SELECT;;FIXE;NON;48.837706, -1.594566;Normandie;50;50218
184252;CINEMA VERTIGO;RUE DE LA MEGISSERIE;CINEAZUR;;FIXE;NON;43.760736, 1.999613;Occitanie;81;81105
190281;LE MELIES;7, RUE DU THEATRE;CINEM'HAM;SARL CINEODE;FIXE;NON;49.747151, 3.074474;Hauts-de-France;80;80410
192833;CENTRE CULTUREL;SQUARE DU 8 MAI;ASSOCIATION CINEMA LE PARADISIO;SARL CINEODE;FIXE;NON;50.257558, 3.913904;Hauts-de-France;59;59291
193111;SIRIUS;5 RUE DUGUESCLIN;SOCIETE CINEMATOGRAPHIQUE HAVRAISE;SARL MICROMEGAS DIFFUSION CINEMATOGRAPHIQUE;FIXE;NON;49.501072, 0.145711;Normandie;76;76351
193442;LA TOURNELLE;14 RUE DISPAN;VILLE DE L'HAY LES  ROSES;SARL GPCI;FIXE;NON;48.779749, 2.339014;Ile-de-France;94;94038
199951;MERIDIEN;ROUTE DE PAU;ASSOCIATION LE PARVIS SCENE NATIONALE TARBES PYRENEES;;FIXE;NON;43.242508, -0.005686;Occitanie;65;65226
201253;LE VULCAIN;10 RUE LEON BLUM;ASSOCIATION TRICOLORES DE LOCHRIST CINEMA;SAS CINE DIFFUSION;FIXE;NON;47.827604, -3.253047;Bretagne;56;56090
201753;LA STRADA;25 BOULEVARD PAUL PONS;ASSOCIATION LA STRADA;SARL MC4 DISTRIBUTION;FIXE;NON;43.916183, 5.048509;Provence-Alpes-Côte-d'Azur;84;84054
202891;ESPACE CULTUREL;RUE JEAN BAPTISTE RICHARD;UNIVERCINE;;FIXE;NON;45.557131, 5.910739;Auvergne - Rhône-Alpes;73;73137
203523;ESPACE GERARD PHILIPE;3, RUE CLEMENT HUMBERT;COMMUNAUTE DES COMMUNES DE JARNISY;;FIXE;NON;49.157279, 5.882037;Grand-Est;54;54273
204141;SALLE DE LA CANTINE;3, RUE DU GEYSER;CINEMAFOR;SNC SAGEC - CINE 32 VEO;ITINERANT;NON;45.72693270000001, 3.834929299999999;Auvergne - Rhône-Alpes;42;42039
204312;REGENT;RUE HECTOR DESPRET;ASSOCIATION CINEMA LE REGENT;SONHIR;FIXE;NON;50.296328, 4.097609;Hauts-de-France;59;59324
208981;SALLE JACQUES BREL;SALLE JACQUES BREL;CINECRAN 81;SNC SAGEC - CINE 32 VEO;ITINERANT;NON;43.474778, 2.646568;Occitanie;81;81115
212450;VOX;5 GRANDE RUE MAISON DIEU;PANORAMIC 21;;FIXE;NON;47.842504, 4.365197;Bourgogne - Franche-Comté;21;21336
212871;LE LALANO;LE LALANO;ASSOCIATION LE PARVIS SCENE NATIONALE TARBES PYRENEES;SNC SAGEC - CINE 32 VEO;FIXE;NON;43.310067, 0.33742;Occitanie;65;65250
215183;MEGA CGR;RUE GUSTAVE ZEDE;IMAGE 56;SARL LES FILMS DE LA ROCHELLE;FIXE;OUI;47.775894, -3.35298;Bretagne;56;56098
218381;LOUIS JOUVET;1 AVENUE DE LA GARE;L'ECRAN;;FIXE;NON;42.988146, -0.425403;Nouvelle Aquitaine;64;64320
219191;MEGA CGR;ZAC DES COMMANDEURS;MONDLATTES;SARL LES FILMS DE LA ROCHELLE;FIXE;OUI;43.584563, 3.935363;Occitanie;34;34129
221712;LE SENECHAL;102 RUE NATIONALE;DESMAZES PATRICK;SNC SAGEC - CINE 32 VEO;FIXE;NON;43.934628, 0.620319;Occitanie;32;32208
223593;EVEN;18 RUE ALSACE LORRAINE;ASSOCIATION CULTURELLE DE LA COTE DES LEGENDES;SAS CINE DIFFUSION;FIXE;NON;48.572208, -4.327487;Bretagne;29;29124
224165;CLAP CINE;RUE SALVADOR DALI;CINEX LOISIRS;;FIXE;NON;42.841052, 3.039151;Occitanie;11;11202
225444;GRAND ECRAN;56 AVENUE GALLIENI;SOCIETE D EXPLOITATION GRAND ECRAN;STE D'EXPLOITATION GRAND ECRAN (FRIDMAN);FIXE;OUI;44.913546, -0.237461;Nouvelle Aquitaine;33;33243
226211;SALLE ST MICHEL;1 RUE ARISTIDE BRIAND;ASSOCIATION CULTURELLE CINEMA SAINT MICHEL;SAS CINE DIFFUSION;FIXE;NON;48.213038, -1.504786;Bretagne;35;35152
226974;UGC;40/48 RUE DE BETHUNE;UGC SAS;UGC DIFFUSION;FIXE;OUI;50.633831, 3.063221;Hauts-de-France;59;59350
229082;TRIANON;BD DE LA PLAGE;SOCIETE NORMANDE D EXPLOITATION INDUSTRIELLE ET COMMERCIALE;;FIXE;NON;49.301809, -0.316265;Normandie;14;14365
230152;VIGNY;42 RUE BOURDILLET;NAGOT MARC;;FIXE;NON;47.129518, 0.993278;Centre - Val-de-Loire;37;37132
230301;LE CLUB;1 RUE JEAN MARIE LAMMENAIS;ASSOCIATION CINEMA LE CLUB;SARL MICROMEGAS DIFFUSION CINEMATOGRAPHIQUE;FIXE;NON;47.88976, -2.835941;Bretagne;56;56117
231939;THEATRE DE LONGJUMEAU;20 AVENUE DU GENERAL DE GAULLE;PRODUCENE;;FIXE;NON;48.679684, 2.313256;Ile-de-France;91;91345
232584;4C;RUE DES CORDELIERS;ESPACE COMMUNAUTAIRE LONS AGGLOMERATION;SARL MC4 DISTRIBUTION;FIXE;NON;46.674335, 5.555107;Bourgogne - Franche-Comté;39;39300
233001;CINEVILLE;4 BOULEVARD DU MARECHAL  JOFFRE;SOCIETE RENNAISE DE DIFFUSION CINEMATOGRAPHIQUE;SAS CINE DIFFUSION;FIXE;OUI;47.751879, -3.366695;Bretagne;56;56121
234295;CINEMA BERNADETTE;6 AV MGR SCHOEPFER;JACALS;;FIXE;NON;43.095917, -0.055559;Occitanie;65;65286
235942;ESPACE RONSARD;PLACE DU CHAMP DE FOIRE;VILLE DU LUDE;;FIXE;NON;47.643316, 0.156442;Pays de la Loire;72;72176
236001;UGC CINE CITE;350 RUE DES MAZUROTS;UGC CINE CITE;UGC DIFFUSION;FIXE;OUI;48.617851, 6.173437;Grand-Est;54;54328
237903;PATHE;79 RUE DE LA REPUBLIQUE;PARAFRANCE COMMUNICATION;LES CINEMAS GAUMONT PATHE;FIXE;OUI;45.758734, 4.834873;Auvergne - Rhône-Alpes;69;69123
237933;COMOEDIA;13 AV BERTHELOT;UGC SAS;;FIXE;OUI;45.747368, 4.835557;Auvergne - Rhône-Alpes;69;69123
238244;CINEMA BELLECOMBE;61 RUE D INKERMANN;ASSOCIATION BIENFAISANCE CHARMETTES;;FIXE;NON;45.765819, 4.865911;Auvergne - Rhône-Alpes;69;69123
239353;CINE MARIVAUX;70 RUE MICHEL DEBRE;CINEMA MARIVAUX;LES CINEMAS GAUMONT PATHE;FIXE;OUI;46.316471, 4.838508;Bourgogne - Franche-Comté;71;71270
243839;SALLE LEONARD DE VINCI;ESTEREL GALLERY;AIX FILMS;;FIXE;NON;43.535959, 6.929182;Provence-Alpes-Côte-d'Azur;6;6079
245911;VOX;RUE DES ECOLES;CINEMA VOX;SNC SAGEC - CINE 32 VEO;FIXE;NON;46.276444, 4.040561;Bourgogne - Franche-Comté;71;71275
248254;PLAZA;32/36 BOULEVARD DE MARE;ASSOCIATION PROMOTION ACTIVITE CULTURELLE AUDIOVISUELLE MARMANDE;SNC SAGEC - CINE 32 VEO;FIXE;NON;44.497638, 0.168923;Nouvelle Aquitaine;47;47157
248763;ESPACE CULTUREL BEAUMARCHAIS;13 RUE DE LA REPUBLIQUE;VILLE DE MAROMME;SARL NORD OUEST EXPLOITATION CINEMA;FIXE;NON;49.479355, 1.042864;Normandie;76;76410
249451;BONNEVEINE;AVENUE DE HAMBOURG;SOCIETE DES CINEMAS DE BONNEVEINE;LES CINEMAS GAUMONT PATHE;FIXE;NON;43.249625, 5.389984;Provence-Alpes-Côte-d'Azur;13;13055
250410;CHATEAU DE LA BUZINE;56 TRAVERSE DE LA BUZINE;CINEMATHEQUE DE MARSEILLE;;FIXE;NON;43.294553, 5.498707;Provence-Alpes-Côte-d'Azur;13;13055
250751;LE SILVERADO;LA CLE DES CHANTS;LE BISTROT;SNC SAGEC - CINE 32 VEO;FIXE;NON;45.611664, 0.44206;Nouvelle Aquitaine;16;16211
250935;JEAN RENOIR;ALLEE JEAN RENOIR;ASSOCIATION CINEMA RENOIR;;FIXE;NON;43.410526, 5.052683;Provence-Alpes-Côte-d'Azur;13;13056
254173;CINEMAZ;RUE DE L' HOTEL DE VILLE;LES TOILES DU REX;;FIXE;NON;43.250817, 1.677678;Occitanie;9;9185
255421;SALLE COMMUNALE;SALLE COMMUNALE;CINE ITINERANT RURAL BRESSE REVERMONT;;ITINERANT;NON;46.245266, 5.347704;Auvergne - Rhône-Alpes;1;1241
257772;LE STUDIO;CHEMIN DES DAMES;SOCIETE DU PATRONAGE SAINT MICHEL;SAS CINE DIFFUSION;FIXE;NON;48.19242, -2.416156;Bretagne;22;22147
258161;MERIGNAC CINE;PLACE CHARLES DE GAULLE;IPEC;;FIXE;NON;44.842142, -0.647041;Nouvelle Aquitaine;33;33281
259022;FAMILY FUN PARK;49 ROUTE DE SEMUSSAC;FAMILY FUN BOWLING;SNC SAGEC - CINE 32 VEO;FIXE;NON;45.564042, -0.95352;Nouvelle Aquitaine;17;17230
260903;CENTRE D ART ET DE CULTURE;15 BOULEVARD DES NATIONS-UNIES;VILLE DE MEUDON;;FIXE;NON;48.81334, 2.235774;Ile-de-France;92;92048
260904;ESPACE CULTUREL ROBERT-DOISNEAU;16 AV DE LATTRE DE TASSIGNY;VILLE DE MEUDON;;FIXE;NON;48.7873, 2.23254;Ile-de-France;92;92048
262921;LE PARNASSE;3 AVENUE DE LA GARE;COMMUNE DE MIMIZAN;CINE LANDES;FIXE;NON;44.20143, -1.228686;Nouvelle Aquitaine;40;40184
263484;RIO;4 BIS RUE STE CECILE;VILLE DE MIRECOURT;;FIXE;NON;48.299898, 6.132591;Grand-Est;88;88304
263612;SALLE DES FETES;SALLE DES FETES;ASSOCIATION REGIONALE PROMOTION DU CINEMA;;ITINERANT;NON;45.871817, 4.913437;Auvergne - Rhône-Alpes;1;1249
263912;CONCORDE;4 AV DES BOSQUETS;ASSOCIATION MITRYENNE DE LOISIRS;SARL GPCI;FIXE;NON;48.956929, 2.603083;Ile-de-France;77;77294
264672;LA ROTONDE;PLACE DU 14 JUILLET;SCENE NATIONALE DE SENART;;FIXE;NON;48.628281, 2.589982;Ile-de-France;77;77296
266213;CINE'MONCLAR;PLACE DES CAPITOULS;ASSOCIATION CINEFOL 31;;FIXE;NON;43.966813, 1.584453;Occitanie;82;82115
266292;STELLA;RUE JEANNE D ARC;ASSOCIATION CINEMA DU BOCAGE;SUD CINE;FIXE;NON;46.724207, -0.587156;Nouvelle Aquitaine;79;79179
266361;UGC CINE CITE;RUE ERNEST COGNACQ;UGC CINE CITE MONDEVILLE;UGC DIFFUSION;FIXE;OUI;49.166065, -0.30018;Normandie;14;14437
266571;LA BOBINE;22 RUE DU COMMERCE;ASSOCIATION FOYER RURAL CENTRE SOCIAL ET CULTUREL;SNC SAGEC - CINE 32 VEO;FIXE;NON;43.320215, -0.579262;Nouvelle Aquitaine;64;64393
267061;FOYER RURAL;SALLE RAYMOND DEVOS;CINE-OFF;;ITINERANT;NON;47.499906, 0.752013;Centre - Val-de-Loire;37;37153
270562;ROYAL CINEMA;18-20 RUE DU MARECHAL BOSQUET;ROYAL CINEMA;SARL GPCI;FIXE;NON;43.889338, -0.504397;Nouvelle Aquitaine;40;40192
271052;PALACE;16 BD DU PECHER;SOCIETE DU CINEMA PALACE - MONTELIMAR;SARL MICROMEGAS DIFFUSION CINEMATOGRAPHIQUE;FIXE;NON;44.561459, 4.748988;Auvergne - Rhône-Alpes;26;26198
272358;CINEMA JEAN GABIN;RUE DES ECOLES;OFFICE DU TOURISME DE MONTGENEVRE;SARL MC4 DISTRIBUTION;FIXE;NON;44.932175, 6.724754;Provence-Alpes-Côte-d'Azur;5;5085
272481;LE CINE;ALLEE DES PLATANES;ASS LES AMIS DU CINEMA;SAINT LOUIS;FIXE;NON;45.217551, -0.186333;Nouvelle Aquitaine;17;17241
274502;CINEMA LUX;1, RUE DU GÉNÉRAL LECLERC;CENTRE REGIONAL AUDIOVISUEL DE LORRAINE;;FIXE;NON;49.519626, 5.363556;Grand-Est;55;55351
274543;CHARLIE CHAPLIN;PLACE DU CENTENAIRE;COMMUNE DE MONTMELIAN;;FIXE;NON;45.500407, 6.048642;Auvergne - Rhône-Alpes;73;73171
274682;LE MONTMORELIEN;AVENUE D'AQUITAINE;LES BONIMENTEURS;SNC SAGEC - CINE 32 VEO;FIXE;NON;45.396196, 0.130119;Nouvelle Aquitaine;16;16230
274702;L'EDEN;5 RUE DE PONTOISE;CINELAB MONTMORENCY;;FIXE;NON;48.988818, 2.318091;Ile-de-France;95;95428
274900;SALLE D'ANIMATION RURALE;CHEMIN DE CHAMBE;LE NAVIRE;;ITINERANT;NON;44.794674, 4.937598;Auvergne - Rhône-Alpes;26;26208
275311;GAUMONT MULTIPLEXE;235 RUE GEORGES MELIES;GAUMONT;LES CINEMAS GAUMONT PATHE;FIXE;OUI;43.603985, 3.91557;Occitanie;34;34172
275336;Maison pour Tous et Cinéma Louis Feuillade;410 AVENUE DE BARCELONE;COMMUNE DE MONTPELLIER;;FIXE;NON;43.624323, 3.817591;Occitanie;34;34172
277331;RUITOR;CENTRE COMMERCIAL LES TERRASSES;DAVOINE ET COMPAGNIE;SARL MC4 DISTRIBUTION;FIXE;NON;45.62746, 6.848058;Auvergne - Rhône-Alpes;73;73176
278241;LA SALAMANDRE;RUE EUGENE POTTIER;LA SALAMANDRE;SAS CINE DIFFUSION;FIXE;NON;48.589341, -3.817369;Bretagne;29;29151
278802;LE PARIS;9 BIS GRANDE RUE;COMMUNAUTE DE COMMUNES DU VAL DE MORTEAU;;FIXE;NON;47.056013, 6.605836;Bourgogne - Franche-Comté;25;25411
278805;L ATALANTE;PLACE DE L HOTEL DE VILLE;MAISON DES JEUNES ET DE LA CULTURE DE MORTEAU;;FIXE;NON;47.05651, 6.604743;Bourgogne - Franche-Comté;25;25411
282631;KINEPOLIS;175 AVENUE ROBERT SCHUMAN;KINEPOLIS MULHOUSE;KINEPOLIS;FIXE;OUI;47.760377, 7.351564;Grand-Est;68;68224
282922;L ARVERNE;18 AVENUE HECTOR PESCHAUD;VILLE DE MURAT;SNC SAGEC - CINE 32 VEO;FIXE;NON;45.110108, 2.86664;Auvergne - Rhône-Alpes;15;15138
283043;FREDERIC DARD CLUB A;77 RUE PAUL DOUMER;ASSOCIATION DE DIFFUSION CULTURELLE DES MUREAUX;;FIXE;NON;48.993874, 1.910246;Ile-de-France;78;78440
283105;VEO - GRAND - MERMOZ;AVENUE JACQUES DOUZANS;VEO-MURET;SNC SAGEC - CINE 32 VEO;FIXE;OUI;43.465865, 1.326927;Occitanie;31;31395
283523;CINEMA LE ROHAN;39, RUE DU CHATEAU;VILLE DE MUTZIG;;FIXE;NON;48.536154, 7.453136;Grand-Est;67;67313
283551;SALLE JEANNE D ARC;RUE RENE BAZIN;ASSOCIATION GROUPE JEANNE D'ARC;SAS CINE DIFFUSION;FIXE;NON;47.555803, -2.484734;Bretagne;56;56143
284121;CAMEO;16, RUE DE LA COMMANDERIE;EOLE CINE;;FIXE;NON;48.687007, 6.172177;Grand-Est;54;54395
284362;LA BERGERIE;COUR EMILE ZOLA;COMMUNE DE NANGIS;;FIXE;NON;48.555127, 3.0133;Ile-de-France;77;77327
287391;LE VIKING;68 RUE DE LA REPUBLIQUE;ASSOCIATION REXY SIRIUS;;FIXE;NON;49.148993, 0.902155;Normandie;27;27428
287462;CINEMA 2001;23 AV DE LA CONCORDE;LES AMIS DU CINEMA 2001-2002;ENT. REG. CIN. NORD PAS DE CALAIS;FIXE;NON;50.632496, 1.578876;Hauts-de-France;62;62604
288151;LE VILLAGE I;4 RUE DE CHEZY;PARAFRANCE COMMUNICATION;UGC DIFFUSION;FIXE;NON;48.885364, 2.268222;Ile-de-France;92;92051
288571;LE PARADISIO;PLACE DE LA MAIRIE;LE PRE BOURGES;SNC SAGEC - CINE 32 VEO;FIXE;NON;45.38274, 2.272379;Nouvelle Aquitaine;19;19148
289344;REX;4 AV DU 11 NOVEMBRE;REX CINEMA;;FIXE;NON;45.87473, 4.841744;Auvergne - Rhône-Alpes;69;69143
290044;PATHE MASSENA;31 AVENUE JEAN MEDECIN;PATHE NICE;LES CINEMAS GAUMONT PATHE;FIXE;NON;43.702059, 7.266941;Provence-Alpes-Côte-d'Azur;6;6088
291144;MEGA CGR;PLACE DE LA BRECHE;HELLUCHA;SARL LES FILMS DE LA ROCHELLE;FIXE;OUI;46.337524, -0.481854;Nouvelle Aquitaine;79;79191
293630;COMPLEXE CULTUREL OESIA;ROND-POINT DE LA CHASSETIERE;CINE-OFF;;FIXE;NON;47.448213, 0.694335;Centre - Val-de-Loire;37;37172
297871;FORUM;RUE DU PARLEMENT;CINE FORUM;SARL CINEPROFILMS;FIXE;NON;44.137785, 4.809487;Provence-Alpes-Côte-d'Azur;84;84087
298831;LES CARMES;7 RUE DES CARMES;EDEN CARMES;;FIXE;NON;47.901533, 1.900955;Centre - Val-de-Loire;45;45234
298834;PATHE ORLEANS;2 RUE DES HALLES;MARTROI;LES CINEMAS GAUMONT PATHE;FIXE;OUI;47.89856839999999, 1.9088173000000097;Centre - Val-de-Loire;45;45234
299572;CINEMA JACQUES TATI;14 AVENUE SAINT LAURENT;ASSOCIATION MJC MAISON DES JEUNES ET DE LA CULTURE D' ORSAY;SARL MICROMEGAS DIFFUSION CINEMATOGRAPHIQUE;FIXE;NON;48.698781, 2.189727;Ile-de-France;91;91471
302933;REX;19 RUE TAILLANCIER;TOILES DU TEMPS;;FIXE;NON;43.116608, 1.612993;Occitanie;9;9225
305014;LE MELIES;6 RUE BARGOIN;ASSOCIATION CINE MA PASSION;;FIXE;NON;43.301543, -0.372504;Nouvelle Aquitaine;64;64445
305041;MEGA CGR;PLACE DU 7EME ART;LUMONPAU;SARL LES FILMS DE LA ROCHELLE;FIXE;OUI;43.302981, -0.369831;Nouvelle Aquitaine;64;64445
305632;REX;6 AVENUE JULLES FERRY;BERNARD JACQUES ANDRE JEAN;;FIXE;NON;45.371031, 4.797096;Auvergne - Rhône-Alpes;38;38298
309331;LE CLUB;PLACE DU CHAMP DE FOIRE;LA ZINZEN;SNC SAGEC - CINE 32 VEO;FIXE;NON;45.813639, 1.772698;Nouvelle Aquitaine;87;87117
310106;LE CLUB;LOBAU;ANIMATION SUR LA PLACE;;FIXE;NON;48.768553, 7.258661;Grand-Est;57;57540
310180;MEGARAMA PIAN MEDOC;ROUTE DE PAUILLAC;CS MULTIMEDIA;SAS AGORA CINEMAS;FIXE;NON;44.952219, -0.629792;Nouvelle Aquitaine;33;33322
310542;MAISON DU PEUPLE;PLACE JEAN JAURES;VILLE DE PIERRE BENITE;;FIXE;NON;45.703741, 4.823295;Auvergne - Rhône-Alpes;69;69152
314451;ESPACE PAUL VALERY;72 ET 74 AVENUE ARDOUIN;RENCONTRES ANIMATIONS PLESSEENNES;;FIXE;NON;48.80535, 2.578145;Ile-de-France;94;94059
315312;IMAGES;RUE DE SALTASH;ASSOCIATION IMAGES;SAS CINE DIFFUSION;FIXE;NON;48.373269, -4.370987;Bretagne;29;29189
317442;TRIANON;1 RUE DE L ABREUVOIR;ESPACE TRIANON;SARL GPCI;FIXE;NON;49.776307, 1.980512;Hauts-de-France;80;80630
319161;LE DIAMANT;6, RUE ALEXANDRE DUMAS;LE DIAMANT;SARL MC4 DISTRIBUTION;FIXE;NON;45.53638, 5.670755;Auvergne - Rhône-Alpes;38;38315
320311;REX;ZONE DE NIEL;CINEGYR PONTIVY;CINERGYR-CARNAC;FIXE;NON;48.068322, -2.948573;Bretagne;56;56178
324731;ATLANTIQUE;7 GRANDE RUE;ASSOCIATION SAINT ETIENNE CINEMA;SUD CINE;FIXE;NON;47.12792959999999, -2.215288200000032;Pays de la Loire;44;44136
326263;THEATRE DE PROPRIANO;PARC DES SPORTS SAN GUISEPPE;THEATRE DE PROPRIANO VITA E CULTURA;SARL MC4 DISTRIBUTION;FIXE;NON;41.671492, 8.91212;Corse;2A;2A249
326550;LE REXY;QUARTIER DELORT;APP;UGC DIFFUSION;FIXE;NON;48.559158, 3.304398;Ile-de-France;77;77379
326741;EXCELSIOR;ABBAZIA;BOUIS ANGELE JEANNE (NÉE DELFINO);;FIXE;NON;42.003231, 9.362695;Corse;2B;2B251
327092;SALLE POLYVALENTE;SALLE POLYVALENTE;LE CINEMA DU SOLEIL;SNC SAGEC - CINE 32 VEO;ITINERANT;NON;43.288803, 6.130491;Provence-Alpes-Côte-d'Azur;83;83100
327945;UGC CINE CITE LA DEFENSE;LE DOME;UGC CINE CITE;UGC DIFFUSION;FIXE;OUI;48.876233, 2.242749;Ile-de-France;92;92062
327961;LE CENTRAL;134 RUE DE LA REPUBLIQUE;COMMUNE DE PUTEAUX;UGC DIFFUSION;FIXE;NON;48.885137, 2.239127;Ile-de-France;92;92062
328244;CINE DYKE;PLACE MICHELET;CINE DYKE;;FIXE;NON;45.040387, 3.886089;Auvergne - Rhône-Alpes;43;43157
333683;LA CASTINE;12 RUE DU GENERAL KOENIG;ASSOCIATION CULTURELLE DE REICHSHOFFEN;;FIXE;NON;48.931499, 7.660695;Grand-Est;67;67388
333751;MAISON POUR TOUS;MAISON POUR TOUS;CINEBUS;;ITINERANT;NON;46.153096, 6.238556;Auvergne - Rhône-Alpes;74;74220
334606;MAJESTIC LE FRANCE;Eco Quartier La Filature;ECRANS DU GRAND EST;;FIXE;NON;48.012165, 6.601788;Grand-Est;88;88383
335054;ARVOR;29 RUE D'ANTRAIN;ASSOCIATION ARVOR CINEMA ET CULTURE;SAS CINE DIFFUSION;FIXE;NON;48.11601, -1.67887;Bretagne;35;35238
335303;REX;PLACE DE LA LIBERATION;ASSOCIATION ECRAN REOLAIS;SAINT LOUIS;FIXE;NON;44.582404, -0.036426;Nouvelle Aquitaine;33;33352
338902;CINE RELAIS - LA PASSERELLE;RUE DES LOISIRS;ASSO CENTRE SOCIO CULTUREL LA PASSERELLE;;FIXE;NON;47.750793, 7.411718;Grand-Est;68;68278
343321;STE BARBE;14 BIS RUE YANN D ARGENT;CINEMA SAINTE BARBE;SAS CINE DIFFUSION;FIXE;NON;48.724745, -3.984009;Bretagne;29;29239
345421;SALLE POLYVALENTE;SALLE POLYVALENTE;ASSOCIATION POUR LE DEVELOPPEMENT AUDIOVISUEL EN MILIEU RURAL;;ITINERANT;NON;43.839788, 6.151962;Provence-Alpes-Côte-d'Azur;4;4172
346502;LIDO;65 FRONT DE MER;CINÉMA & LOISIRS;;FIXE;NON;45.62416, -1.025656;Nouvelle Aquitaine;17;17306
346622;CINEMA THEATRE;BOULEVARD DU GENERAL LECLERC;CINEODE;SARL CINEODE;FIXE;NON;49.69929, 2.790104;Hauts-de-France;80;80685
347831;LE FOYER;4 RUE DES TOURNELLES;ASSOCIATION D' EDUCATION POPULAIRE CINEMA LE FOYER;SARL MC4 DISTRIBUTION;FIXE;NON;44.453436, 4.339659;Auvergne - Rhône-Alpes;7;7201
348296;LE GRAND PALACE;BD DE L ILE VERTIME;LE PALACE DES SABLES D'OLONNE;;FIXE;NON;46.501653, -1.786349;Pays de la Loire;85;85194
348314;CTRE CULTUREL JOEL LE THEULE;16 RUE SAINT DENIS;ASSOCIATION ENTRACTE;;FIXE;NON;47.839188, -0.3382865999999467;Pays de la Loire;72;72264
350414;CINE MONT BLANC;AVENUE DE GENEVE;CINE MONT BLANC;SAS CINE MONTBLANC (Baud);FIXE;OUI;45.944805, 6.630005;Auvergne - Rhône-Alpes;74;74256
350542;LE CONCORDE;SERRE CHEVALIER;SOCIETE DES CINEMAS DE LA GUISANE;SAS AGORA CINEMAS;FIXE;NON;44.915761, 6.542422;Provence-Alpes-Côte-d'Azur;5;5161
351052;ARCADES;6 PLACE GAMBETTA;CINE SPECTACLES;SARL MC4 DISTRIBUTION;FIXE;NON;43.637886, 5.099752;Provence-Alpes-Côte-d'Azur;13;13103
352610;PATHE SARAN;1010 RUE NATIONALE;MARTROI;LES CINEMAS GAUMONT PATHE;FIXE;OUI;47.94652, 1.895679;Centre - Val-de-Loire;45;45302
357751;REX;5 PLACE DE LA 2EME DB;SEES DU CINE;GENERIQUE;FIXE;NON;48.607433, 0.170941;Normandie;61;61464
358561;LE STUDIO;PLACE CHARLES DE GAULLE;CINEMA STUDIO DE SELLES SUR CHER;CVL;FIXE;NON;47.274507, 1.55439;Centre - Val-de-Loire;41;41242
364961;SALLE COMMUNALE;SALLE COMMUNALE;LE CINEMA DU SOLEIL;SNC SAGEC - CINE 32 VEO;ITINERANT;NON;43.19314, 6.005894;Provence-Alpes-Côte-d'Azur;83;83131
367052;OCEANIC;68 RUE DE LA PLAGE;ARTS ET TECHNIQUES;ARTEC;FIXE;NON;45.51424, -1.123506;Nouvelle Aquitaine;33;33514
367453;LA SALINE;PLACE DU GÉNÉRAL DE GAULLE;COMMUNE DE SOULTZ SOUS FORETS;;FIXE;NON;48.935358, 7.883424;Grand-Est;67;67474
368801;LE STAR;27/31 RUE DU JEU DES ENFANTS;LE CINEMATOGRAPHE;;FIXE;NON;48.583754, 7.742752;Grand-Est;67;67482
370073;ESPACE JEAN-MARIE POIRIER;ESPLANADE DU 18 JUIN 1940;VILLE DE SUCY EN BRIE;SARL GPCI;FIXE;NON;48.772452, 2.512597;Ile-de-France;94;94071
370483;LE PALACE;RUE DES TROIS  FRERES NADEAU;ESPACE CULTUREL LE PALACE;SAINT LOUIS;FIXE;NON;46.108206, -0.750249;Nouvelle Aquitaine;17;17434
371131;LE MODERNE;1 BOULEVARD CARNOT;ECRANS SPECTACLES SUD AVEYRON;SNC SAGEC - CINE 32 VEO;FIXE;NON;43.955721, 2.884014;Occitanie;12;12208
374903;JOACASINO;128 RUE PASTEUR;SOCIETE NORMANDE D EXPLOITATION INDUSTRIELLE ET COMMERCIALE;SARL GPCI;FIXE;NON;49.329525, -0.385911;Normandie;14;14562
376802;SALLE ST LOUIS  CENTRAL;RUE DE LA TRESORERIE;SAINT JEAN ASSOCIATION;;FIXE;NON;44.682199, 6.075234;Provence-Alpes-Côte-d'Azur;5;5132
377083;CINEJADE;PARC ACTIVITES  DE LA GUERCHE;SUD ESTUAIRE ET LITTORAL - OFFICE DE TOURISME;SNC SAGEC - CINE 32 VEO;FIXE;NON;47.246308, -2.135768;Pays de la Loire;44;44154
377441;ZOOM;PLACE DE L HOTEL DE VILLE;MAISON DES JEUNES ET DE LA CULTURE;;FIXE;NON;47.920147, 0.743555;Pays de la Loire;72;72269
381260;CINEMA CASINO;ROUTE DE BANDOL;LE CINEMA DU SOLEIL;SARL CINEODE;FIXE;NON;43.19174, 5.713725;Provence-Alpes-Côte-d'Azur;83;83112
382552;CINE-QUAI;QUAI LAMARTINE;COMPLEXE CINEMATOGRAPHIQUE MARNAIS;;FIXE;NON;48.640036, 4.95025;Grand-Est;52;52448
385421;CINE GLONNE;GRANDE RUE;CINE GLONNE;;FIXE;NON;47.363746, -1.0164589999999407;Pays de la Loire;49;49244
385491;DELTA;17 BIS PLACE D ARMES;HAUTE AUVERGNE MEDIA;SNC SAGEC - CINE 32 VEO;FIXE;NON;45.03382, 3.095174;Auvergne - Rhône-Alpes;15;15187
386864;LES 4 PERRAY;44/46 AV GABRIEL PERI;CINAEA;;FIXE;NON;48.647712, 2.326708;Ile-de-France;91;91549
386961;LINO VENTURA;3 RUE DE L'EGLISE;ASSOCIATION CINEFOL 31;SNC SAGEC - CINE 32 VEO;FIXE;NON;43.682793, 1.486048;Occitanie;31;31484
387092;JEANNE D ARC;AVENUE DE SAINTES;ARTS ET TECHNIQUES;SNC SAGEC - CINE 32 VEO;FIXE;NON;45.485115, -0.566824;Nouvelle Aquitaine;17;17331
387191;L ATMOSPHERE SALLE A PREJEAN;PLACE PIERRE DESCOTES;ASSOCIATION CINEMA L'ATMOSPHERE;;FIXE;NON;45.599999, 5.633175;Auvergne - Rhône-Alpes;73;73236
387661;JULIEN MAUNOIR;11 AVENUE DES ACACIAS;ASSOCIATION JULIEN MAUNOIR;SAS CINE DIFFUSION;FIXE;NON;48.506874, -1.241635;Bretagne;35;35271
390271;ERMITAGE;RUE SIMON;COMMUNE DE SAINT GOBAIN;SARL CINEODE;FIXE;NON;49.597177, 3.378189;Hauts-de-France;2;2680
390680;SALLE DES FETES;1 PLACE DU 11 NOVEMBRE;CONCEPT ET TECHNIQUE CINEMATOGRAPHIQUE;;ITINERANT;NON;49.7511844, 0.40355909999993855;Nouvelle Aquitaine;33;33417
390793;UGC CINE CITE ATLANTIS;PLACE JEAN BART;UGC CINE CITE;UGC DIFFUSION;FIXE;OUI;47.224381, -1.625621;Pays de la Loire;44;44162
390821;LE TIGRE;PLACE DE LA LIBERTE;AEP CINEMA LE TIGRE;SNC SAGEC - CINE 32 VEO;FIXE;NON;46.556503, -1.061779;Pays de la Loire;85;85223
391951;SELECT CINE;18 RUE HENRI RENAUD;COMMUNE DE SAINT HONORE LES BAINS;;FIXE;NON;46.905158, 3.842831;Bourgogne - Franche-Comté;58;58246
392671;EDEN BOURVIL;6 AVENUE PASTEUR;VEO CINEMAS;SNC SAGEC - CINE 32 VEO;FIXE;NON;45.94953, -0.518149;Nouvelle Aquitaine;17;17347
393293;STAR;137 AV HENRI FALCOZ;SNC GIPPA ET GILBERT;MAURIENNE;FIXE;NON;45.277364, 6.348249;Auvergne - Rhône-Alpes;73;73248
394201;LE VAUBAN;4 RUE RENAUD;GARAZIKUS;SAINT LOUIS;FIXE;NON;43.16402, -1.237591;Nouvelle Aquitaine;64;64485
395463;LE SELECT;CONTIS PLAGE;ASSOCIATION A CONTIS;SNC SAGEC - CINE 32 VEO;FIXE;NON;44.079661, -1.257781;Nouvelle Aquitaine;40;40266
395484;CINEMA ROUGE ET NOIR;7 RUE AMEDEE VIII DE SAVOIE;ALLONS AU CINEMA;SARL MC4 DISTRIBUTION;FIXE;NON;46.144524, 6.080637;Auvergne - Rhône-Alpes;74;74243
396771;LES TRAVAILLEURS SYNDIQUES;RUE JOSEPH NIVET;COMMUNE DE SAINT LAURENT DE CERDANS;CINEMAGINAIRE;FIXE;NON;42.38271, 2.614735;Occitanie;66;66179
396961;LE SAINT LAURENT;4 BIS AVENUE DES CHATAIGNERS;ASSOCIATION LE PARVIS SCENE NATIONALE TARBES PYRENEES;;FIXE;NON;43.08008, 0.480895;Occitanie;65;65389
399686;LE VAUBAN 2- LA GRANDE PASSERELLE;LA GRANDE PASSERELLE;ASSOCIATION CINEMA LE VAUBAN;SAS CINE DIFFUSION;FIXE;NON;48.602575, -2.005943;Bretagne;35;35288
399689;CINE VAUBAN;45 RUE DE LA CROIX DESILLES;CINE VAUBAN;;FIXE;OUI;48.657589, -1.970525;Bretagne;35;35288
399721;LA MALOUINE;LE BOURG;"SOCIETE DE SPORTS ET D  EDUCATION POPULAIRE ""LA MALOUINE"" CINEMA";SAS CINE DIFFUSION;FIXE;NON;47.339858, -2.175644;Pays de la Loire;44;44176
403400;SALLE BARBARA;SALLE BARBARA;CINEVILLAGES;SARL MICROMEGAS DIFFUSION CINEMATOGRAPHIQUE;ITINERANT;NON;47.434568, -0.703599;Pays de la Loire;49;49306
405772;L'ETOILE;PLACE DE LA REPUBLIQUE;ARTS ET TECHNIQUES;ARTEC;FIXE;NON;44.893791, -0.715027;Nouvelle Aquitaine;33;33449
407871;OCINE;RUE DU LION D'OR;OCINE;OCINE;FIXE;OUI;50.750679, 2.250328;Hauts-de-France;62;62765
408323;UTOPIA;1 PLACE MENDES-FRANCE;ASSOCIATION CINEMAS DES DEUX RIVES;;FIXE;NON;49.044334, 2.106823;Ile-de-France;95;95572
409142;CIRCUIT ALAIN RESNAIS;2 AVENUE MAS SALAT;OFFICE CULTUREL CLERMONTAIS;;ITINERANT;NON;43.528827, 3.517645;Occitanie;34;34281
409903;7 EME ART;ROUTE DE PIERRELATTE;LE NAVIRE;SARL CINEODE;FIXE;NON;44.353475, 4.739599;Auvergne - Rhône-Alpes;26;26324
411244;CENTRE CULTUREL COMMUNAL;37BIS AVENUE DE LA REPUBLIQUE;CINE-OFF;;FIXE;NON;47.389603, 0.719808;Centre - Val-de-Loire;37;37233
412532;SAINT POURCINOIS;COUR DES BENEDICTINS;COMMUNAUTE DE COMMUNES SAINT POURCAIN SIOULE LIMAGNE;;ITINERANT;NON;46.307498, 3.289943;Auvergne - Rhône-Alpes;3;3254
414162;CINE PALACE;4 AV FAUCONNET;ASSOCIATION CINE PALACE;SARL MC4 DISTRIBUTION;FIXE;NON;43.788778, 4.829098;Provence-Alpes-Côte-d'Azur;13;13100
