numCinema;nomCinema;adresseCinema;proprietaireCinema;programmateurCinema;genre;multiplexe;geolocalisation;nouvelleRegion;numDepartement;numCommune
405462;CINEMAS MARCEL PAGNOL;107 ROUTE DU PLAN DE LA TOUR;LES CINEMAS DE SAINTE MAXIME;;FIXE;NON;43.32495, 6.62431;Provence-Alpes-Côte-d'Azur;83;83115
405831;LE CELTIC;RUE THEODORE BOTREL;LES ENFANTS DE SAINT MEEN;SAS CINE DIFFUSION;FIXE;NON;48.188591, -2.192564;Bretagne;35;35297
408122;VOX;RUE AMBROISE CROIZAT;COMMUNE DE SAINT OUEN (SOMME);SARL CINEODE;FIXE;NON;50.038633, 2.123723;Hauts-de-France;80;80711
408441;ESPACE 1789;7/9 RUE DES ROSIERS;CENTRE AUDONIEN ET FRANCILIEN D'ART ET DE CULTURE;;FIXE;NON;48.904144, 2.339193;Ile-de-France;93;93070
408682;SAINT LOUIS;CINEMA;ASSOCIATION ARGITZE;SAINT LOUIS;FIXE;NON;43.327875, -1.034919;Nouvelle Aquitaine;64;64493
408744;LE SURF;31 BIS RUE DU LOGIS VERT;VALZ MICHEL;SARL CINEODE;FIXE;NON;45.64428, -1.088823;Nouvelle Aquitaine;17;17380
411461;ELDORADO;5 RUE DE LA REPUBLIQUE;LIEN OLERONNAIS POUR LA CULTURE L  ANIMATION ET LES LOISIRS;SNC SAGEC - CINE 32 VEO;FIXE;NON;45.943128, -1.308557;Nouvelle Aquitaine;17;17385
415471;MEGA CGR;ROUTE D'ALENCON;SOCIETE DE PARTICIPATIONS CINEMATOGRAPHIQUES;SARL LES FILMS DE LA ROCHELLE;FIXE;OUI;48.06123, 0.167196;Pays de la Loire;72;72320
417332;LE SEJEFY S;11 AV CHARLES DE GAULLE;VEO CINEMAS;SNC SAGEC - CINE 32 VEO;FIXE;NON;43.77186, 1.688125;Occitanie;81;81271
418121;LE FOYER;210 RUE DU CHANOINE PAVAILLER;AEP CINEMA LE FOYER;SNC SAGEC - CINE 32 VEO;FIXE;NON;45.629307, 4.452451;Auvergne - Rhône-Alpes;69;69238
419912;GRAND ECRAN;24 AVENUE NATIONALE;CINETYR;SAINT LOUIS;FIXE;NON;43.660752, -1.304343;Nouvelle Aquitaine;40;40284
421242;UGC TALENCE;ALLEE DU 7EME ART;UGC CINE CITE;UGC DIFFUSION;FIXE;OUI;44.811682, -0.592543;Nouvelle Aquitaine;33;33522
422432;LE LEM;62 AV DU 8 MAI 1945;ASSOCIATION DIFFUSION EXPLOITATION CINEMATOGRAPHIQUE SUD EST;GROUPEMENT DES SALLES FAMILIALES DE LYON (GSF);FIXE;NON;45.761019, 4.761288;Auvergne - Rhône-Alpes;69;69244
423061;REGAIN;3 MONTEE DU CHATEAU;ASSOCIATION CINEBOL;SARL MC4 DISTRIBUTION;FIXE;NON;44.550873, 4.681776;Auvergne - Rhône-Alpes;7;7319
423501;LE BEGO;AV DU 16 SEPTEMBRE 1947;ASSOCIATION MAISON DES JEUNES ET DE LA CULTURE;;FIXE;NON;44.08886, 7.593211;Provence-Alpes-Côte-d'Azur;6;6163
424781;ST LOUIS;15 RUE DE LA CROIX;ASSOCIATION LE FOYER THEILLOIS;SARL GPCI;FIXE;NON;48.265259, 0.690629;Normandie;61;61484
426761;LE ROC;IMMEUBLE LES EFFALEES;SOCIETE DES CINEMAS DU CHABLAIS;SARL CINEODE;FIXE;NON;46.389621, 6.718783;Auvergne - Rhône-Alpes;74;74279
427312;CINEMA SAINT-LOUIS;1 IMPASSE DE L EVECHE;SYNDICAT D INITIATIVE DE THOUARCE;SAS CINE DIFFUSION;FIXE;NON;47.267642, -0.502889;Pays de la Loire;49;49345
428103;CINEMA;ZAC DU VAL CLARET;MONTAGNE CINE AUDIO;SARL MC4 DISTRIBUTION;FIXE;NON;45.456559, 6.900294;Auvergne - Rhône-Alpes;73;73296
428483;LE NORMANDY;BD DU MIDI;LIGUE DE L' ENSEIGNEMENT DE BASSE-NORMANDIE;GENERIQUE;FIXE;NON;48.763163, -0.732609;Normandie;61;61486
428711;CINE PASSION;CINE PASSION;ASSOCIATION CINE PASSION EN PERIGORD;SNC SAGEC - CINE 32 VEO;ITINERANT;NON;45.252655, 0.493333;Nouvelle Aquitaine;24;24553
428942;REX 1;RUE DU MARECHAL FOCH;ASSOCIATION POUR LA PROMOTION ET L'ANIMATION DU CINE A TONNEINS;SAINT LOUIS;FIXE;NON;44.391294, 0.311793;Nouvelle Aquitaine;47;47310
428961;CINEMA THEATRE;PLACE DE L HOTEL DE VILLE;VILLE DE TONNERRE;;FIXE;NON;47.856492, 3.972991;Bourgogne - Franche-Comté;89;89418
429951;LE ROYAL;2 ET 4 RUE DU DOCTEUR;ASSOCIATION CINEMA LE ROYAL - TOULON;;FIXE;NON;43.124501, 5.96296;Provence-Alpes-Côte-d'Azur;83;83137
430261;LE CRATERE;95 GRANDE RUE SAINT MICHEL;ASSOCIATION CINEFOL 31;;FIXE;NON;43.588909, 1.445984;Occitanie;31;31555
430446;GAUMONT WILSON;3 PLACE WILSON;GAUMONT;LES CINEMAS GAUMONT PATHE;FIXE;OUI;43.60456, 1.44782;Occitanie;31;31555
430886;LES ECRANS;4, PROMENADE DE LA FRATERNITÉ;SOCIETE DES CINEMAS DE L  OUEST;UGC DIFFUSION;FIXE;NON;50.721235, 3.15888;Hauts-de-France;59;59599
430923;RESEAU SUD LUBERON;43 BOULEVARD DE VERDUN;BASILIC DIFFUSION;;ITINERANT;NON;43.726077, 5.547136;Provence-Alpes-Côte-d'Azur;84;84133
431023;AUDITORIUM EQUINOXE;6 - 8 RUE DE L'HOTEL DE VILLE;CINEODE;SARL CINEODE;FIXE;NON;45.562468, 5.444145;Auvergne - Rhône-Alpes;38;38509
431604;LA PALETTE;37 RUE DE LA REPUBLIQUE;FOURNIER CHRISTOPHE CINEMA;;FIXE;NON;46.562498, 4.912313;Bourgogne - Franche-Comté;71;71543
433972;JACQUES TATI;29 BIS AV CHARLES DE GAULLE;ASSOCIATION TREMBLAYSIENNE POUR LE CINEMA;;FIXE;NON;48.99649, 2.550261;Ile-de-France;93;93073
436962;PARADISO;3 RUE PASTEUR;IMA 3;SARL MC4 DISTRIBUTION;FIXE;NON;45.297176, 5.483039;Auvergne - Rhône-Alpes;38;38517
438622;CINEMA LOUIS JOUVET;PLACE DE LA LIBERATION;VILLE D'UZERCHE;SNC SAGEC - CINE 32 VEO;FIXE;NON;45.424402, 1.563016;Nouvelle Aquitaine;19;19276
439061;L'ENTR'ACTES;RUELLE DES VIAUX;VAGNEY LOISIRS;;FIXE;NON;48.008328, 6.71485;Grand-Est;88;88486
439503;LES VISITEURS DU SOIR;QUARTIER DE LA VIGNASSE;LES VISITEURS DU SOIR;SARL MC4 DISTRIBUTION;FIXE;NON;43.641892, 7.006394;Provence-Alpes-Côte-d'Azur;6;6152
439942;LUX;36 BD DU GENERAL DE GAULLE;LUX SCENE NATIONALE DE VALENCE;;FIXE;NON;44.930191, 4.893946;Auvergne - Rhône-Alpes;26;26362
440286;SALLE HENRI VERNEUIL;LA COUPIANE;POLYMAGES;SNC SAGEC - CINE 32 VEO;FIXE;NON;43.131815, 5.988887;Provence-Alpes-Côte-d'Azur;83;83144
441172;CINEMA VALMEINIER 1800;ESPACE CULTUREL LES ISLETTES;OFFICE DU TOURISME DE VALMEINIER;;FIXE;NON;45.174957, 6.493547;Auvergne - Rhône-Alpes;73;73307
442002;LE VANVES;12 RUE SADI CARNOT;VILLE DE VANVES;;FIXE;NON;48.821779, 2.287439;Ile-de-France;92;92075
442370;CINEMA CONFLUENCES VARENNES;PETIT FOSSARD;CINE MONTEREAU POINT COM;Montereau Point Com (Aubry);FIXE;OUI;48.367677, 2.957289;Ile-de-France;77;77482
444143;LES AMPHIS;RUE PIERRE COT;VILLE DE VAULX EN VELIN;;FIXE;NON;45.789822, 4.917721;Auvergne - Rhône-Alpes;69;69256
445201;FOYER RURAL;RUE DES MAQUISARDS;ASSOCIATION CINE SPECTACLES L'UXELLO;SNC SAGEC - CINE 32 VEO;FIXE;NON;44.954501, 1.70171;Occitanie;46;46330
446204;OBAULABA PLEIN AIR;46 AVENUE DE L'EUROPE;ORGANISATION CINEMATOGRAPHIQUE FAVARD;;ITINERANT;NON;45.355735, -1.060588;Nouvelle Aquitaine;33;33540
446302;LE DIAPASON;14 RUE JEAN HOLWEG;COMMUNE DE VENDENHEIM;;FIXE;NON;48.666901, 7.711243;Grand-Est;67;67506
447622;CAROUSSEL;12 PLACE CHEVERT;BLN MAJESTIC;BLN MAJESTIC (Lengrand);FIXE;OUI;49.159325, 5.38635;Grand-Est;55;55545
450575;CLUB 6;ESPACE VILLON;CINE 70;;FIXE;NON;47.636582, 6.166288;Bourgogne - Franche-Comté;70;70550
454032;CINE'FIL;PLACE SAINT JEAN;LE CINE FIL;SARL MICROMEGAS DIFFUSION CINEMATOGRAPHIQUE;FIXE;NON;47.14704, -0.536932;Pays de la Loire;49;49373
454712;ARIANE;IMMEUBLE CERES;SNC GIPPA ET GILBERT;MAURIENNE;FIXE;NON;45.244201, 6.263395;Auvergne - Rhône-Alpes;73;73318
455770;LE COLOMBIER;PLACE CHARLES DE GAULLE;COMMUNE D AVRAY;SARL GPCI;FIXE;NON;48.824654, 2.18397;Ile-de-France;92;92077
456362;CINE BOR;RUE BOR;ASSOCIATION CINEFOL 31;;FIXE;NON;43.398281, 1.715623;Occitanie;31;31582
456762;CINEMA D ART ROMAIN ROLLAND;18 RUE EUGENE VARLIN;THEATRE ROMAIN ROLLAND;;FIXE;NON;48.793428, 2.363199;Ile-de-France;94;94076
457983;ESPACE CULTUREL;56BIS AVENUE CARNOT;COMMUNE DE VILLENEUVE LE ROI;;FIXE;NON;48.735355, 2.416829;Ile-de-France;94;94077
458401;CYRANO;9 BD DE LA MARINE;SARL MINAS;GRAND ECRAN;FIXE;NON;44.408808, 0.704017;Nouvelle Aquitaine;47;47323
460784;ZOLA;117 COURS EMILE ZOLA;ASSOCIATION POUR LE CINEMA;;FIXE;NON;45.770555, 4.874404;Auvergne - Rhône-Alpes;69;69266
461663;LE CASINO;13 RUE GUILLAUME BUDE;COMMUNE DE VILLIERS SUR MARNE;SARL GPCI;FIXE;NON;48.826124, 2.542402;Ile-de-France;94;94079
462953;LE BASSELIN;PLACE CASTEL;COMMUNE DE VIRE;;FIXE;NON;48.838655, -0.892968;Normandie;14;14762
463723;LES LUMIERES;ARCADES DES CITEAUX;SOCIETE D'ECONOMIE MIXTE VITROLLES ANIMATION;SARL MC4 DISTRIBUTION;FIXE;NON;43.447301, 5.250042;Provence-Alpes-Côte-d'Azur;13;13117
463931;3 CINES ROBESPIERRE;19 AVENUE MAXIMILIEN ROBESPIERRE;VILLE DE VITRY SUR SEINE;;FIXE;NON;48.790948, 2.388152;Ile-de-France;94;94081
464692;PASSRL LES ECRANS;RUE GEORGES CLEMENCEAU;LE ROYAL;;FIXE;NON;45.365575, 5.589119;Auvergne - Rhône-Alpes;38;38563
465920;SALLE DES FETES;SALLE DES FETES;FEDERATION DEPARTEMENTALE DES MAISONS DES JEUNES ET DE LA CULTUR;;ITINERANT;NON;49.714863, 3.584145;Hauts-de-France;2;2517
710250;LE QUAI DES ARTS;LA GARE;IMAGES ET SONS DES 3 PROVINCES;SNC SAGEC - CINE 32 VEO;FIXE;NON;45.390497, 3.946964;Auvergne - Rhône-Alpes;42;42318
718750;KINEPOLIS BRETIGNY;5 RUE MICHELE MORGAN;KINEPOLIS PROSPECTION;KINEPOLIS;FIXE;OUI;48.57924680000001, 2.2996356999999534;Ile-de-France;91;91103
719400;SALLE ALAIN BASHUNG;PLACE DE LA LIBERTE;PANORAMIC;;FIXE;NON;48.032408, 3.296723;Bourgogne - Franche-Comté;89;89348
720000;POLE CULTUREL AUGUSTE ESCOFFIER;POLE CULTUREL AUGUSTE ESCOFFIER;COMMUNE DE VILLENEUVE LOUBET;SARL MC4 DISTRIBUTION;FIXE;NON;43.658327, 7.12373;Provence-Alpes-Côte-d'Azur;6;6161
720250;MAJESTIC PALACE;ZAC DES PLAINES DE FIGUEROLLES;SOCIETE D  EXPLOITATION DU PALACE;SAS D'EXPLOITATION DU PALACE (Lavalée);FIXE;OUI;43.43362, 5.050227;Provence-Alpes-Côte-d'Azur;13;13056
721500;CINEVILLE;6 ESPLANADE MARIE DE KERSTRAT;CINEVILLE;SAS CINE DIFFUSION;FIXE;OUI;48.00072, -4.109877;Bretagne;29;29232
721900;CGR VITROLLES;2 RUE GERARD TOULON;SOCIETE D EXPLOITATION CINEMATOGRAPHIQUE FILS;SARL LES FILMS DE LA ROCHELLE;FIXE;OUI;43.437442, 5.25529;Provence-Alpes-Côte-d'Azur;13;13117
722080;LA PLEIADE;154 RUE DE LA MAIRIE;CINE-OFF;;FIXE;NON;47.38634, 0.653023;Centre - Val-de-Loire;37;37195
722240;MUCEM;7 PROMENADE ROBERT LAFFONT;MUSEE DES CIVILISATIONS DE L'EUROPE ET DE LA MEDITERRANEE;;FIXE;NON;43.297725, 5.360374;Provence-Alpes-Côte-d'Azur;13;13055
722720;STUDIO 53;AVENUE DE L'AGORA;ASSOCIATION CINE PASSION EN PERIGORD;SNC SAGEC - CINE 32 VEO;FIXE;NON;45.182708, 0.762663;Nouvelle Aquitaine;24;24053
723800;CGR VILLEFRANCHE SUR SAONE;193 RUE DE LA QUARANTAINE;FRANCHEMOND;SARL LES FILMS DE LA ROCHELLE;FIXE;OUI;45.989161, 4.724226;Auvergne - Rhône-Alpes;69;69264
723840;LA PARENTHESE;46 RUE DESLANDES;CINE-OFF;;FIXE;NON;47.345608, 0.608054;Centre - Val-de-Loire;37;37018
724280;CINEMA DE VAUJANY;PLACE DU TÉLÉPHÉRIQUE;COMMUNE DE VAUJANY;;FIXE;NON;45.164059, 6.089026;Auvergne - Rhône-Alpes;38;38527
724840;SALLE DE PROJECTION SPECTACLE DU GRENIER DE MONSIEUR;RUE DU GRENIER;BENAC HERVE;;FIXE;NON;44.182478, 2.786721;Occitanie;12;12307
35;BALZAC;1 RUE BALZAC;CINELBA;;FIXE;NON;48.872431, 2.299525;Ile-de-France;75;75108
481;GAUMONT PARNASSE;3 RUE D'ODESSA;PARAFRANCE COMMUNICATION;LES CINEMAS GAUMONT PATHE;FIXE;OUI;48.843074, 2.324424;Ile-de-France;75;75114
531;MK2 BEAUBOURG;50 RUE RAMBUTEAU;MK2 CINEMAS;SA MK2 VISION;FIXE;NON;48.861555, 2.352217;Ile-de-France;75;75103
801;MK2 PARNASSE;11 RUE JULES CHAPLAIN;MK2 CINEMAS;SA MK2 VISION;FIXE;NON;48.842813, 2.330525;Ile-de-France;75;75106
1392;L'ARCHIPEL;17 BD DE STRASBOURG;PARIS CINE;;FIXE;NON;48.870455, 2.35466;Ile-de-France;75;75110
2251;MAJESTIC PASSY;18 - 20 RUE DE PASSY;LES ECRANS DE PARIS;;FIXE;NON;48.858204, 2.282104;Ile-de-France;75;75116
5691;MK2 GAMBETTA;6 RUE BELGRAND;MK2 CINEMAS;SA MK2 VISION;FIXE;NON;48.864763, 2.399555;Ile-de-France;75;75120
5841;MK2 BASTILLE COTE FAUBOURG SAINT-ANTOINE;5 RUE DU FAUBOURG ST ANTOINE;BASTILLE SAINT ANTOINE (DOUBLON N° 95 7200);SA MK2 VISION;FIXE;NON;48.853157, 2.370719;Ile-de-France;75;75111
5852;MAJESTIC BASTILLE;4 BD RICHARD LENOIR;LES ECRANS DE PARIS;;FIXE;NON;48.860238, 2.37214;Ile-de-France;75;75111
6531;UGC LYON BASTILLE;12 RUE DE LYON;UGC SAS;UGC DIFFUSION;FIXE;NON;48.847502, 2.371855;Ile-de-France;75;75112
7394;GAUMONT CONVENTION;27 RUE ALAIN CHARTIER;GAUMONT;LES CINEMAS GAUMONT PATHE;FIXE;OUI;48.837759, 2.296259;Ile-de-France;75;75115
8161;CHAPLIN DENFERT;24 PLACE DENFERT ROCHEREAU;SOCIETE D'EXPLOITATION DU THEATRE DENFERT ROCHEREAU;;FIXE;NON;48.833879, 2.330976;Ile-de-France;75;75114
8391;LE CINEMA DU PANTHEON;13 RUE VICTOR COUSIN;LES FILMS DE LA GARENNE;;FIXE;NON;48.847502, 2.342301;Ile-de-France;75;75105
8661;ESCURIAL;11 BD PORT ROYAL;LES ECRANS DE PARIS;;FIXE;NON;48.836817, 2.349632;Ile-de-France;75;75113
9803;LES 7 BATIGNOLLES CINEMOVIDA;ALLEE COLETTE HEILBRONNER;LES 7 BATIGNOLLES;LES CINEMAS GAUMONT PATHE;FIXE;NON;48.893315, 2.311503;Ile-de-France;75;75117
9950;CGR PARIS LILAS;PLACE DU MAQUIS DU VERCORS;CINELILAS;SARL LES FILMS DE LA ROCHELLE;FIXE;NON;48.852605, 2.406733;Ile-de-France;75;75120
12833;LA SALLE DE SPECTACLE ET LE CINEMA;493 AVENUE DE LA GARE;73210 ZIMAGES;;FIXE;NON;45.555539, 6.651442;Auvergne - Rhône-Alpes;73;73006
13151;GALAXIE;16 AV DES PYRENEES;CUNY ROBERT JOSEPH AUGUST;;FIXE;NON;43.699953, -0.265292;Nouvelle Aquitaine;40;40001
13454;ARMAND LUNEL;RUE DES ALLUMETTES;INSTITUT DE L'IMAGE;;FIXE;NON;43.524462, 5.439812;Provence-Alpes-Côte-d'Azur;13;13001
14533;CINEPLANET;BOULEVARD VAUBAN;COMPAGNIE CINEMATOGRAPHIQUE IMMOBILIERE CEVENOLE;SARL MC4 DISTRIBUTION;FIXE;OUI;44.125939, 4.077527;Occitanie;30;30007
15374;BEL' DONNE;PLACE DE VERDUN;BOCCA BERNARD ALBERT;SNC SAGEC - CINE 32 VEO;FIXE;NON;45.394059, 6.075331;Auvergne - Rhône-Alpes;38;38006
15741;CINEMA DE L AIGUILLE;RESIDENCE DE L AIGUILLE;LEATHOM;SARL MC4 DISTRIBUTION;FIXE;NON;44.283294, 6.539965;Provence-Alpes-Côte-d'Azur;4;4006
16081;PALACE LUMIERE;2, BOULEVARD CLÉMENCEAU;CHARLES PAUL;SARL NORD OUEST EXPLOITATION CINEMA;FIXE;NON;47.62383, 7.236058;Grand-Est;68;68004
16803;CINEA;3 PLACE ST DENIS;SARL MERLIN L;;FIXE;NON;47.41057, 0.980035;Centre - Val-de-Loire;37;37003
17803;EDEN 3;90 RUE ANDREE ET MARCE BRAUD;ASSOCIATION LOUIS LUMIERE;;FIXE;NON;47.364116, -1.178442;Pays de la Loire;44;44003
17961;CINEMA DE LA VIOUZE;AVENUE DE LA GARE;CINEMA DE LA VIOUZE;SNC SAGEC - CINE 32 VEO;FIXE;NON;45.928236, 2.829038;Auvergne - Rhône-Alpes;63;63004
19242;LE CASTEILL;PLACE DU CASTELL;REGIE AUTONOME DES SPORTS ET LOISIRS LES ANGLES;SARL GPCI;FIXE;NON;42.577018, 2.075079;Occitanie;66;66004
19901;PATHE ANNECY;"AV. DE BROGNY - ZAC ""COURIER""";PATHE ANNECY DECAVISION;LES CINEMAS GAUMONT PATHE;FIXE;OUI;45.912917, 6.125425;Auvergne - Rhône-Alpes;74;74010
22051;GRAND ECRAN;9 BIS AVENUE GAMBETTA;SARL GRAND ECRAN;STE D'EXPLOITATION GRAND ECRAN (FRIDMAN);FIXE;NON;44.660258, -1.168378;Nouvelle Aquitaine;33;33009
22231;PATHE;46 AVENUE MARIE CURIE;SOCIETE DES GRANDS ECRANS DU GENEVOIS;LES CINEMAS GAUMONT PATHE;FIXE;OUI;46.1393558, 6.124697400000059;Auvergne - Rhône-Alpes;74;74016
23131;CASINO;2 PLACE DESPOURRINS;ASSOCIATION LE PARVIS SCENE NATIONALE TARBES PYRENEES;;FIXE;NON;43.005826, -0.095968;Occitanie;65;65025
23241;NORMANDY;13 RUE MEHEUDIN;LES FEUX DE LA RAMPE;SAS CINE DIFFUSION;FIXE;NON;48.745411, -0.019397;Normandie;61;61006
23541;CIN EVASION;6 RUE AMBROISE PARE;LES JEUNES D'ARGENTRE;SAS CINE DIFFUSION;FIXE;NON;48.058076, -1.148927;Bretagne;35;35006
25179;MAISON DU VAL D'AZUN;1PLACE DU VAL D'AZUN;ASSOCIATION LE PARVIS SCENE NATIONALE TARBES PYRENEES;;FIXE;NON;42.955828, -0.213947;Occitanie;65;65032
26662;L ALCAZAR;1 RUE DE LA STATION;ASSOCIATION DE GESTION DES CINEMAS D ASNIERES;;FIXE;NON;48.906327, 2.284046;Ile-de-France;92;92004
27573;CINEMA VENTURA;RUE SAMUEL DESBORDES;LE CENTRE CULTUREL DES PORTES DE L' ESSONNE;;FIXE;NON;48.7102, 2.388137;Ile-de-France;91;91027
29062;JEAN MARAIS;RUE DES ECOLES;ASSOCIATION CINEFOL 31;SNC SAGEC - CINE 32 VEO;FIXE;NON;43.671301, 1.43582;Occitanie;31;31022
29123;CINE 32;73 AVENUE DE L'YSER;CINE 32;SNC SAGEC - CINE 32 VEO;FIXE;NON;43.651097, 0.594265;Occitanie;32;32013
30761;CINEMA PARADISO THEATRE;RUE DE VERDUN;ASSOCIATION DU CINEMA PARADISO;;FIXE;NON;49.020149, -0.629742;Normandie;14;14027
32092;LE CLOS;LE CLOS;MC4  DISTRIBUTION;SARL MC4 DISTRIBUTION;FIXE;NON;45.1750733, 5.540751;Auvergne - Rhône-Alpes;38;38225
32363;ARLETTY;5 RUE PERNETTE;CINEMA ARLETTY;;FIXE;NON;46.95158, 4.296621;Bourgogne - Franche-Comté;71;71014
32651;MEGA CGR CASINO;1 BOULEVARD DU 11 NOVEMBRE;SOCIETE D EXPLOITATION CINEMATOGRAPHIQUE AUXERROISE;SARL LES FILMS DE LA ROCHELLE;FIXE;OUI;47.793473, 3.56576;Bourgogne - Franche-Comté;89;89024
32941;STUDIO 7;LE CHEMIN DES ECOLIERS;CINEMA STUDIO 7;SNC SAGEC - CINE 32 VEO;FIXE;NON;43.543431, 1.565026;Occitanie;31;31036
33621;CAMEO;51 RUE DES PRES;ASSOCIATION LE SONHIR 3;SONHIR;FIXE;NON;50.124842, 3.926833;Hauts-de-France;59;59036
35272;LE CONCORDE;10 RUE DE L ABBE MUNIER;ASSOCIATION D' EDUCATION POPULAIRE ET SOCIALE;;FIXE;NON;48.447747, 6.736992;Grand-Est;54;54039
36352;FLANDRIA;45, RUE DES VIVIERS;OFFICE MUNICIPAL DE LA JEUNESSE ET DE LA CULTURE EDUCATION PERMA;ENT. REG. CIN. NORD PAS DE CALAIS;FIXE;NON;50.740146, 2.736651;Hauts-de-France;59;59043
39174;THEATRE MONTDORY;RUE DU GENERAL GIRAUD;COMMUNE DE BARENTIN;SARL NORD OUEST EXPLOITATION CINEMA;FIXE;NON;49.544612, 0.95126;Normandie;76;76057
40708;CINE POLE SUD;SCI MAPHI;CINE POLE SUD;SARL GPCI;FIXE;OUI;47.215304, -1.465696;Pays de la Loire;44;44009
41781;LE CELTIC;1 RUE DE LA LIBERATION;LES ENFANTS DE LA CLARTE;SARL MICROMEGAS DIFFUSION CINEMATOGRAPHIQUE;FIXE;NON;47.877156, -3.017589;Bretagne;56;56010
42201;STELLA CINEMA;14 RUE DES JUIFS;AEP LE FOYER BAUMOIS STELLA CINEMA;SARL MC4 DISTRIBUTION;FIXE;NON;47.353131, 6.359659;Bourgogne - Franche-Comté;25;25047
42621;MELIES;10/12 RUE GENAS DUHOMME;SOCIETE DU CINEMA LE MELIES;;FIXE;NON;49.278064, -0.70355;Normandie;14;14047
44131;CINEMA LE DUNOIS;11 RUE DE LA MAILLE D OR;COMMUNE DE BEAUGENCY;CVL;FIXE;NON;47.777284, 1.628684;Centre - Val-de-Loire;45;45028
45602;L'ORON;2 AV MICHEL VILLAZ;CLEMENCON BERNADETTE EPOUSE BRACOUD;SARL MC4 DISTRIBUTION;FIXE;NON;45.338891, 5.057286;Auvergne - Rhône-Alpes;38;38034
46613;CINEMA JEAN-CLAUDE CARRIERE;AVENUE DES JUSTES PARMI LES NATIONS;CINE2MA;;FIXE;NON;43.611508, 3.171558;Occitanie;34;34028
47476;PATHE BELFORT;1 BOULEVARD RICHELIEU;PATHE BELFORT;LES CINEMAS GAUMONT PATHE;FIXE;OUI;47.63059, 6.861946;Bourgogne - Franche-Comté;90;90010
52141;PLAZZA VICTOR HUGO;6 RUE GAMBETTA;SAUCIER COLARD CHARLOTTE;;FIXE;NON;47.240015, 6.025346;Bourgogne - Franche-Comté;25;25056
52162;ESPACE PLANOISE;PLACE DE L' EUROPE;ASSOCIATION ESPACE BESANCON PLANOISE;;FIXE;NON;47.21818, 5.973484;Bourgogne - Franche-Comté;25;25056
54692;THEATRE PAUL ELUARD;162 RUE MAURICE BERTEAUX;THEATRE PAUL ELUARD;SARL GPCI;FIXE;NON;48.931156, 2.207081;Ile-de-France;95;95063
54931;ROBERT DOISNEAU;94 AVENUE DE LA REPUBLIQUE;ASSOCIATION MAISON DES JEUNES ET DE LA CULTURE BRETENOUX;SNC SAGEC - CINE 32 VEO;FIXE;NON;44.92068, 1.841345;Occitanie;46;46029
57451;BON ACCUEIL;RUE DES CAPUCINS;ASSOCIATION BON ACCUEIL CINEMA;;FIXE;NON;48.589226, 6.84543;Grand-Est;54;54077
59351;LOUIS JOUVET;6, RUE CURIE;COMMUNE DE BOHAIN EN VERMANDOIS;SARL CINEODE;FIXE;NON;49.983958, 3.455918;Hauts-de-France;2;2095
59604;JEAN RENOIR;RUE DU GENERAL LECLERC;COMMUNE DE BOIS COLOMBES;;FIXE;NON;48.916548, 2.266897;Ile-de-France;92;92009
62804;UGC CINE CITE;13-15 RUE GEORGES BONNAC;UGC SAS;UGC DIFFUSION;FIXE;OUI;44.8405, -0.582021;Nouvelle Aquitaine;33;33063
64352;LE 7 EME ART;PLACE MARMONTEL;COMMUNE DE BORT LES ORGUES;SNC SAGEC - CINE 32 VEO;FIXE;NON;45.401122, 2.498735;Nouvelle Aquitaine;19;19028
66761;STARS;18 RUE NATIONALE;L ETOILE;SAS AGORA CINEMAS;FIXE;NON;50.722562, 1.605722;Hauts-de-France;62;62160
66923;PATHE;26 RUE LE CORBUSIER;EUROPALACES NICE BOULOGNE;LES CINEMAS GAUMONT PATHE;FIXE;NON;48.837649, 2.239534;Ile-de-France;92;92012
67304;RIO BORVO;RUE DE LA PETITE MURETTE;CINEVASION;;FIXE;NON;46.618744, 3.759124;Bourgogne - Franche-Comté;71;71047
67711;CINEMA CLAUDE MILLER;PLACE DE L HOTEL DE VILLE;BENNAAMANE AHMED;SNC SAGEC - CINE 32 VEO;FIXE;NON;45.953962, 1.755702;Nouvelle Aquitaine;23;23030
67904;CINEMA LES ECRINS;RUE GAMBETTA;LES CINEMAS ASSOCIES;;FIXE;NON;45.055549, 6.028706;Auvergne - Rhône-Alpes;38;38052
67981;LA  GRENETTE;COURS DE VERDUN;ALLIANCE BOURGUIGNONNE CINEMATOGRAPHIQUE;SARL LE PARIS (Bouquet);FIXE;NON;46.206273, 5.22595;Auvergne - Rhône-Alpes;1;1053
68423;KINEPOLIS;RUE THEOPHILE DIEDERICHS;KINEPOLIS BOURGOIN;KINEPOLIS;FIXE;OUI;45.590599, 5.277321;Auvergne - Rhône-Alpes;38;38053
68517;LE COEUR D'OR;RUE SAINT JEAN;B.S.M CINE;;FIXE;NON;45.622605, 6.777587;Auvergne - Rhône-Alpes;73;73054
72985;LE FAUTEUIL ROUGE;ZA BOCAPOLE;CINEMAS BOCAGE;;FIXE;NON;46.850232, -0.474956;Nouvelle Aquitaine;79;79049
74339;COSMO CINEMAS;AVENUE DU GENERAL BARBOT;COSMO;SARL CINEPROFILMS;FIXE;NON;44.900658, 6.632743;Provence-Alpes-Côte-d'Azur;5;5023
74471;LE DONJON;PLACE SAINTE ANNE;LETOURNEUR LANIEPCE MARGUERITE;;FIXE;NON;49.471445, -1.631851;Normandie;50;50082
75703;REX 1;3 BD DU GAL KOENIG;BRIVE MEDIA CULTURE;;FIXE;NON;45.158027, 1.529898;Nouvelle Aquitaine;19;19031
80981;LE NORMANDIE;9 AV PIAT;LA COMPAGNIE DES CINEMAS DE LA COTE;SAS CINE DIFFUSION;FIXE;NON;49.290634, -0.113862;Normandie;14;14117
82741;LE TEMPLE;RUE DU BARRY;COMMUNE DE CAMARES;;FIXE;NON;43.824209, 2.878911;Occitanie;12;12044
82752;SALLE POLYVALENTE;SALLE POLYVALENTE;CINEVAL;;ITINERANT;NON;44.162816, 4.889682;Provence-Alpes-Côte-d'Azur;84;84029
84382;CINEMA LE BEAULIEU;ROUTE D'INGRANDES;COMITE DES FETES DE CANDE;SAS CINE DIFFUSION;FIXE;NON;47.551609, -1.038715;Pays de la Loire;49;49054
84745;SALLE RAIMU;AVENUE DE LA BORDE;MJC CENTRE SOCIAL COEUR DE RANGUIN;SARL MC4 DISTRIBUTION;FIXE;NON;43.567121, 6.963836;Provence-Alpes-Côte-d'Azur;6;6029
84830;CANNET TOILES;1 RUE VICTORIEN SARDOU;COMMUNE LE CANNET;SARL MC4 DISTRIBUTION;FIXE;NON;43.576083, 7.017663;Provence-Alpes-Côte-d'Azur;6;6030
84831;CINETOILE ROCHEVILLE;2 AVENUE FRANKLIN ROOSEVELT;COMMUNE LE CANNET;SARL MC4 DISTRIBUTION;FIXE;NON;43.56912, 7.005225;Provence-Alpes-Côte-d'Azur;6;6030
84981;ESPACE CULTUREL FRANCOIS MITTERRAND;PARC GEORGES PIERRE;COMMUNE DE CANTELEU;SARL NORD OUEST EXPLOITATION CINEMA;FIXE;NON;49.452077, 1.037664;Normandie;76;76157
85981;FAVOLS;AVENUE VIGNAU-ANGLADE;ARTS ET TECHNIQUES;ARTEC;FIXE;NON;44.895434, -0.508506;Nouvelle Aquitaine;33;33096
86173;SLE COMMUNALE DU FOYER RURAL;31 RUE MARECHAL FOCH;LE CINEMA DU SOLEIL;SNC SAGEC - CINE 32 VEO;ITINERANT;NON;43.4765018, 6.182329100000061;Provence-Alpes-Côte-d'Azur;83;83032
87646;CINE LES CALANQUES;20 AVENUE EMMANUEL AGOSTINI;CENTRE CULTUREL EMMANUEL AGOSTINI;;FIXE;NON;43.215622, 5.538828;Provence-Alpes-Côte-d'Azur;13;13022
89644;MILLENIUM;PLACE DES MANTILLES;COMMUNE DE CAUDRY;;FIXE;NON;50.127719, 3.415275;Hauts-de-France;59;59139
90312;FEMINA;58 COURS GAMBETTA;LES CINEMAS DE CAVAILLON;;FIXE;NON;43.837243, 5.040229;Provence-Alpes-Côte-d'Azur;84;84035
90313;LA CIGALE;79 AV DU MARECHAL JOFFRE;LES CINEMAS DE CAVAILLON;;FIXE;NON;43.834515, 5.041736;Provence-Alpes-Côte-d'Azur;84;84035
94745;CINE TRISKELL;PLACE DU FOIRAIL;CINE AVENIR;;FIXE;NON;46.84884, -1.872212;Pays de la Loire;85;85047
94802;LE CHALL ENGER;PLACE LOUIS DUMOLLARD;COMMUNE DE CHALLES LES EAUX;;FIXE;NON;45.548622, 5.986578;Auvergne - Rhône-Alpes;73;73064
94922;ESPACE CINE;RUE FELIX FAURE;COMMUNE DE CHALONNES SUR LOIRE;SARL MICROMEGAS DIFFUSION CINEMATOGRAPHIQUE;FIXE;NON;47.353192, -0.764716;Pays de la Loire;49;49063
95041;NEF;5 RUE FRUCTIDOR;ANEMONE SARL;;FIXE;NON;46.781473, 4.853059;Bourgogne - Franche-Comté;71;71076
96533;JEAN GABIN;RUE PIERRE DE COUBERTIN;CINE MONTEREAU POINT COM;;FIXE;NON;48.398755, 2.80515;Ile-de-France;77;77079
96950;SALLE YVES RENAULT;4 RUE JEAN PERRIN;CINE-OFF;;FIXE;NON;47.341938, 0.723719;Centre - Val-de-Loire;37;37050
99051;CINE LUMIERE;8 RUE TRAVOT;ASSOCIATION GESTION DU CINEMA LE SULLY;SARL CINEODE;FIXE;NON;46.68832, -1.052512;Pays de la Loire;85;85051
104032;ETOILE;RUE DES TOURS CARREES;ASSOCIATION ETOILE CINEMA;SAS CINE DIFFUSION;FIXE;NON;48.110334, -1.405013;Bretagne;35;35068
104863;APOLLO;4 RUE ALBERT 1ER;ASSOCIATION POUR LA GESTION DES ESPACES CULTURELS;;FIXE;NON;46.810828, 1.697689;Centre - Val-de-Loire;36;36044
104933;SALLE SAINT JEAN;2 RUE POINCARÉ;COMMUNE DE CHATEAU SALINS;;FIXE;NON;48.822643, 6.507084;Grand-Est;57;57132
105092;LE CHAMOIS;95 ROUTE DE VONNES;SOCIETE DES CINEMAS DU CHABLAIS;;FIXE;NON;46.2662845, 6.84154239999998;Auvergne - Rhône-Alpes;74;74063
105404;LOFT CINEMAS;PLACE DU CHATELET;SARL CINEA;;FIXE;NON;46.820621, 0.544345;Nouvelle Aquitaine;86;86066
106031;CINEMA;7BIS RUE DE LA MAIRIE;THEATRE DE CHATILLON;;FIXE;NON;48.800675, 2.288049;Ile-de-France;92;92020
108592;FOYER CULTUREL;PLACE CAIL;CINE CHEF;SNC SAGEC - CINE 32 VEO;FIXE;NON;46.108833, -0.068552;Nouvelle Aquitaine;79;79083
110372;STUDIO 31;31 PLACE D'ARIANE;LE CINEMA DE CHESSY;SARL GPCI;FIXE;NON;48.856412, 2.773682;Ile-de-France;77;77111
111071;VOX;AV DE JAGORNAC;ASSOCIATION SOU DES ECOLES LAIQUES DE LA VILLE DU CHEYLARD;SARL MC4 DISTRIBUTION;FIXE;NON;44.907088, 4.421455;Auvergne - Rhône-Alpes;7;7064
111583;FRANCOIS TRUFFAUT;2 RUE DE L ECOLE;ASSOCIATION FRANCOIS TRUFFAUT;;FIXE;NON;48.703333, 2.314917;Ile-de-France;91;91161
112095;CINEMOVIDA;ARCADES ROUGES;SOCIETE NOUVELLE D  ENTREPRISE DE SPECTACLES;;FIXE;OUI;47.061739, -0.881773;Pays de la Loire;49;49099
112811;LUMIERE;PLACE EVARISTE GRAS;SOCIETE DU KURSAAL CINEMA;;FIXE;NON;43.175703, 5.604941;Provence-Alpes-Côte-d'Azur;13;13028
113271;LE MAGNOAC;LE MAGNOAC;ASSOCIATION LE PARVIS SCENE NATIONALE TARBES PYRENEES;;FIXE;NON;43.257218, 0.483469;Occitanie;65;65148
114211;SALLE JEAN GIONO;LE BOURG;ECRAN VAGABOND DU TRIEVES;;FIXE;NON;44.814065, 5.63181;Auvergne - Rhône-Alpes;38;38113
114523;SALLE LEBRUN;7, PLACE CORROYER;COMMUNE DE CLERMONT;SARL CINEODE;FIXE;NON;49.377974, 2.414916;Hauts-de-France;60;60157
114717;LES AMBIANCES;7 RUE SAINT DOMINIQUE;LE PARIS;SARL MC4 DISTRIBUTION;FIXE;NON;45.778539, 3.081053;Auvergne - Rhône-Alpes;63;63113
115334;LE CONNETABLE;ZAC ILOT CHAMP DE FOIRE;CINEMA LE CONNETABLE;SAS CINE DIFFUSION;FIXE;NON;47.083295, -1.287262;Pays de la Loire;44;44043
115511;LES ARTS;PLACE DU MARCHE;COMMUNE DE CLUNY;;FIXE;NON;46.43482, 4.657216;Bourgogne - Franche-Comté;71;71137
115521;DANAY;71 ROUTE DE L' ETALE;DUO;;FIXE;NON;45.904524, 6.425393;Auvergne - Rhône-Alpes;74;74080
115565;CINETOILES;14 PLACE DES ALLOBROGES;CINEVALLEES;;FIXE;NON;46.058081, 6.580638;Auvergne - Rhône-Alpes;74;74081
116021;RAIMU;AVENUE GEORGE CLEMENCEAU;POLYMAGES;;FIXE;NON;43.250728, 6.537455;Provence-Alpes-Côte-d'Azur;83;83042
